{
  message: {
    id: '62e2033c951c5e00210a2447',
    account_status: 'active',
    approval_status: 'approved',
    profile_keys: 'Worker',
    profile_keys_raw: [ { id: 'profile_30', identifier: 'Worker' } ],
    field_658: 118433,
    field_658_raw: 118433,
    field_659: 118633,
    field_659_raw: 118633,
    field_660: 'W-118633',
    field_660_raw: 'W-118633',
    field_303: 'Jhon Chiza4816',
    field_303_raw: {
      first: 'Jhon',
      last: 'Chiza4816',
      formatted_value: 'Jhon Chiza4816'
    },
    field_304: '',
    field_305: '',
    field_306: 'active',
    field_306_raw: 'active',
    field_307: '<span class="profile_30">Worker</span>',
    field_307_raw: [ 'profile_30' ],
    field_315: '<span class="5fbd6688490f05001bc6d819">TNU Services - Intelcom</span>',
    field_315_raw: [
      {
        id: '5fbd6688490f05001bc6d819',
        identifier: 'TNU Services - Intelcom'
      }
    ],
    field_320: '',
    field_318: '07/27/2022 11:32pm',
    field_318_raw: {
      date: '07/27/2022',
      date_formatted: '07/27/2022',
      hours: '11',
      minutes: '32',
      am_pm: 'PM',
      unix_timestamp: 1658964720000,
      iso_timestamp: '2022-07-27T23:32:00.000Z',
      timestamp: '07/27/2022 11:32 pm',
      time: 1412
    },
    field_720: '',
    field_1208: '',
    field_1220: '',
    field_1221: '',
    field_1222: '',
    field_1223: '',
    field_1224: '',
    field_1225: '',
    field_1226: '',
    field_1227: '',
    field_1228: '',
    field_1229: 'No',
    field_1229_raw: false,
    field_1230: '',
    field_1231: '',
    field_1231_raw: [],
    field_1232: '',
    field_1233: '',
    field_1234: '',
    field_1235: '',
    field_1236: '',
    field_1237: '',
    field_1238: '',
    field_1238_raw: '',
    field_1241: 'No',
    field_1241_raw: false,
    field_1253: 0,
    field_1253_raw: 0,
    field_1342: 'No',
    field_1342_raw: false,
    field_1373: '',
    field_1547: 'No',
    field_1547_raw: false,
    field_1546: '',
    field_1588: 'Yes',
    field_1588_raw: true,
    field_1899: 3,
    field_1899_raw: 3,
    field_1900: 1,
    field_1900_raw: 1,
    field_1987: '',
    field_2093: '',
    field_2143: 'Jhon Chiza4816',
    field_2143_raw: 'Jhon Chiza4816',
    field_2248: '4816',
    field_2248_raw: '4816',
    field_2250: 'Jhon Chiza4816 - 4816',
    field_2250_raw: 'Jhon Chiza4816 - 4816'
  },
  level: 'info',
  timestamp: '2022-09-13T21:45:24.908Z'
}
{
  message: 'postUrl https://api.knack.com/v1/objects/object_30/records/62e9a2ae27896c002267ba5c payload [object Object]',
  level: 'info',
  timestamp: '2022-09-13T21:45:24.908Z'
}
{
  message: { field_2248: '6540' },
  level: 'info',
  timestamp: '2022-09-13T21:45:24.908Z'
}
{
  message: {
    id: '62e9a2ae27896c002267ba5c',
    account_status: 'active',
    approval_status: 'approved',
    profile_keys: 'Worker',
    profile_keys_raw: [ { id: 'profile_30', identifier: 'Worker' } ],
    field_658: 118974,
    field_658_raw: 118974,
    field_659: 119174,
    field_659_raw: 119174,
    field_660: 'W-119174',
    field_660_raw: 'W-119174',
    field_303: 'Yvan Demasok6540',
    field_303_raw: {
      first: 'Yvan',
      last: 'Demasok6540',
      formatted_value: 'Yvan Demasok6540'
    },
    field_304: '',
    field_305: '*********',
    field_305_raw: '**********',
    field_306: 'active',
    field_306_raw: 'active',
    field_307: '<span class="profile_30">Worker</span>',
    field_307_raw: [ 'profile_30' ],
    field_315: '<span class="5fbd6688490f05001bc6d819">TNU Services - Intelcom</span>',
    field_315_raw: [
      {
        id: '5fbd6688490f05001bc6d819',
        identifier: 'TNU Services - Intelcom'
      }
    ],
    field_320: '<span class="5fbd673eb20d90001bb93d9b">Alexandre Khalifa Khalifa</span>',
    field_320_raw: [
      {
        id: '5fbd673eb20d90001bb93d9b',
        identifier: 'Alexandre Khalifa Khalifa'
      }
    ],
    field_318: '08/02/2022 6:18pm',
    field_318_raw: {
      date: '08/02/2022',
      date_formatted: '08/02/2022',
      hours: '06',
      minutes: '18',
      am_pm: 'PM',
      unix_timestamp: 1659464280000,
      iso_timestamp: '2022-08-02T18:18:00.000Z',
      timestamp: '08/02/2022 06:18 pm',
      time: 1098
    },
    field_720: '',
    field_1208: '',
    field_1220: '',
    field_1221: '',
    field_1222: '',
    field_1223: '',
    field_1224: '',
    field_1225: '',
    field_1226: '',
    field_1227: '',
    field_1228: '',
    field_1229: 'No',
    field_1229_raw: false,
    field_1230: '',
    field_1231: '',
    field_1231_raw: [],
    field_1232: '',
    field_1233: '',
    field_1234: '',
    field_1235: '',
    field_1236: '<span class="5bfecfdd31782f6061574545">Intelcom Courier Canada</span>',
    field_1236_raw: [
      {
        id: '5bfecfdd31782f6061574545',
        identifier: 'Intelcom Courier Canada'
      }
    ],
    field_1237: '',
    field_1238: '',
    field_1238_raw: '',
    field_1241: 'No',
    field_1241_raw: false,
    field_1253: 0,
    field_1253_raw: 0,
    field_1342: 'No',
    field_1342_raw: false,
    field_1373: '',
    field_1547: 'No',
    field_1547_raw: false,
    field_1546: '',
    field_1588: 'No',
    field_1588_raw: false,
    field_1899: 2,
    field_1899_raw: 2,
    field_1900: 0,
    field_1900_raw: 0,
    field_1987: '',
    field_1987_raw: [],
    field_2093: '',
    field_2143: 'Yvan Demasok6540',
    field_2143_raw: 'Yvan Demasok6540',
    field_2248: '6540',
    field_2248_raw: '6540',
    field_2250: 'Yvan Demasok6540 - 6540',
    field_2250_raw: 'Yvan Demasok6540 - 6540'
  },
  level: 'info',
  timestamp: '2022-09-13T21:45:26.198Z'
}
{
  message: 'postUrl https://api.knack.com/v1/objects/object_30/records/62d98e3880065d002156f318 payload [object Object]',
  level: 'info',
  timestamp: '2022-09-13T21:45:26.198Z'
}
{
  message: { field_2248: '5503' },
  level: 'info',
  timestamp: '2022-09-13T21:45:26.198Z'
}
{
  message: {
    id: '62d98e3880065d002156f318',
    account_status: 'active',
    approval_status: 'approved',
    profile_keys: 'Worker',
    profile_keys_raw: [ { id: 'profile_30', identifier: 'Worker' } ],
    field_658: 117807,
    field_658_raw: 117807,
    field_659: 118007,
    field_659_raw: 118007,
    field_660: 'W-118007',
    field_660_raw: 'W-118007',
    field_303: 'fatima diraya5503',
    field_303_raw: {
      first: 'fatima',
      last: 'diraya5503',
      formatted_value: 'fatima diraya5503'
    },
    field_304: '',
    field_305: '*********',
    field_305_raw: '**********',
    field_306: 'active',
    field_306_raw: 'active',
    field_307: '<span class="profile_30">Worker</span>',
    field_307_raw: [ 'profile_30' ],
    field_315: '<span class="5fbd6688490f05001bc6d819">TNU Services - Intelcom</span>',
    field_315_raw: [
      {
        id: '5fbd6688490f05001bc6d819',
        identifier: 'TNU Services - Intelcom'
      }
    ],
    field_320: '<span class="5fbd673eb20d90001bb93d9b">Alexandre Khalifa Khalifa</span>',
    field_320_raw: [
      {
        id: '5fbd673eb20d90001bb93d9b',
        identifier: 'Alexandre Khalifa Khalifa'
      }
    ],
    field_318: '07/21/2022 1:34pm',
    field_318_raw: {
      date: '07/21/2022',
      date_formatted: '07/21/2022',
      hours: '01',
      minutes: '34',
      am_pm: 'PM',
      unix_timestamp: 1658410440000,
      iso_timestamp: '2022-07-21T13:34:00.000Z',
      timestamp: '07/21/2022 01:34 pm',
      time: 814
    },
    field_720: '',
    field_1208: '',
    field_1220: '',
    field_1221: '',
    field_1222: '',
    field_1223: '',
    field_1224: '',
    field_1225: '',
    field_1226: '',
    field_1227: '',
    field_1228: '',
    field_1229: 'No',
    field_1229_raw: false,
    field_1230: '',
    field_1231: '',
    field_1231_raw: [],
    field_1232: '',
    field_1233: '',
    field_1234: '',
    field_1235: '',
    field_1236: '<span class="5bfecfdd31782f6061574545">Intelcom Courier Canada</span>',
    field_1236_raw: [
      {
        id: '5bfecfdd31782f6061574545',
        identifier: 'Intelcom Courier Canada'
      }
    ],
    field_1237: '',
    field_1238: '',
    field_1238_raw: '',
    field_1241: 'No',
    field_1241_raw: false,
    field_1253: 0,
    field_1253_raw: 0,
    field_1342: 'No',
    field_1342_raw: false,
    field_1373: '',
    field_1547: 'No',
    field_1547_raw: false,
    field_1546: '',
    field_1588: 'No',
    field_1588_raw: false,
    field_1899: 19,
    field_1899_raw: 19,
    field_1900: 0,
    field_1900_raw: 0,
    field_1987: '',
    field_1987_raw: [],
    field_2093: '',
    field_2143: 'fatima diraya5503',
    field_2143_raw: 'fatima diraya5503',
    field_2248: '5503',
    field_2248_raw: '5503',
    field_2250: 'fatima diraya5503 - 5503',
    field_2250_raw: 'fatima diraya5503 - 5503'
  },
  level: 'info',
  timestamp: '2022-09-13T21:45:26.835Z'
}
{
  message: 'postUrl https://api.knack.com/v1/objects/object_30/records/62e203803846250021f0b245 payload [object Object]',
  level: 'info',
  timestamp: '2022-09-13T21:45:26.836Z'
}
{
  message: { field_2248: '5503' },
  level: 'info',
  timestamp: '2022-09-13T21:45:26.836Z'
}
{
  message: {
    id: '62e203803846250021f0b245',
    account_status: 'active',
    approval_status: 'approved',
    profile_keys: 'Worker',
    profile_keys_raw: [ { id: 'profile_30', identifier: 'Worker' } ],
    field_658: 118451,
    field_658_raw: 118451,
    field_659: 118651,
    field_659_raw: 118651,
    field_660: 'W-118651',
    field_660_raw: 'W-118651',
    field_303: 'Fatima Diraya5503',
    field_303_raw: {
      first: 'Fatima',
      last: 'Diraya5503',
      formatted_value: 'Fatima Diraya5503'
    },
    field_304: '',
    field_305: '',
    field_306: 'active',
    field_306_raw: 'active',
    field_307: '<span class="profile_30">Worker</span>',
    field_307_raw: [ 'profile_30' ],
    field_315: '<span class="5fbd6688490f05001bc6d819">TNU Services - Intelcom</span>',
    field_315_raw: [
      {
        id: '5fbd6688490f05001bc6d819',
        identifier: 'TNU Services - Intelcom'
      }
    ],
    field_320: '',
    field_318: '07/27/2022 11:33pm',
    field_318_raw: {
      date: '07/27/2022',
      date_formatted: '07/27/2022',
      hours: '11',
      minutes: '33',
      am_pm: 'PM',
      unix_timestamp: 1658964780000,
      iso_timestamp: '2022-07-27T23:33:00.000Z',
      timestamp: '07/27/2022 11:33 pm',
      time: 1413
    },
    field_720: '',
    field_1208: '',
    field_1220: '',
    field_1221: '',
    field_1222: '',
    field_1223: '',
    field_1224: '',
    field_1225: '',
    field_1226: '',
    field_1227: '',
    field_1228: '',
    field_1229: 'No',
    field_1229_raw: false,
    field_1230: '',
    field_1231: '',
    field_1231_raw: [],
    field_1232: '',
    field_1233: '',
    field_1234: '',
    field_1235: '',
    field_1236: '',
    field_1237: '',
    field_1238: '',
    field_1238_raw: '',
    field_1241: 'No',
    field_1241_raw: false,
    field_1253: 0,
    field_1253_raw: 0,
    field_1342: 'No',
    field_1342_raw: false,
    field_1373: '',
    field_1547: 'No',
    field_1547_raw: false,
    field_1546: '',
    field_1588: 'Yes',
    field_1588_raw: true,
    field_1899: 8,
    field_1899_raw: 8,
    field_1900: 1,
    field_1900_raw: 1,
    field_1987: '',
    field_2093: '',
    field_2143: 'Fatima Diraya5503',
    field_2143_raw: 'Fatima Diraya5503',
    field_2248: '5503',
    field_2248_raw: '5503',
    field_2250: 'Fatima Diraya5503 - 5503',
    field_2250_raw: 'Fatima Diraya5503 - 5503'
  },
  level: 'info',
  timestamp: '2022-09-13T21:45:29.829Z'
}
{
  message: 'postUrl https://api.knack.com/v1/objects/object_30/records/62f47a7fb52cfa00216d035b payload [object Object]',
  level: 'info',
  timestamp: '2022-09-13T21:45:29.829Z'
}
{
  message: { field_2248: '5503' },
  level: 'info',
  timestamp: '2022-09-13T21:45:29.829Z'
}
{
  message: {
    id: '62f47a7fb52cfa00216d035b',
    account_status: 'active',
    approval_status: 'approved',
    profile_keys: 'Worker',
    profile_keys_raw: [ { id: 'profile_30', identifier: 'Worker' } ],
    field_658: 120187,
    field_658_raw: 120187,
    field_659: 120387,
    field_659_raw: 120387,
    field_660: 'W-120387',
    field_660_raw: 'W-120387',
    field_303: 'Fatima Diraya5503',
    field_303_raw: {
      first: 'Fatima',
      last: 'Diraya5503',
      formatted_value: 'Fatima Diraya5503'
    },
    field_304: '',
    field_305: '',
    field_306: 'active',
    field_306_raw: 'active',
    field_307: '<span class="profile_30">Worker</span>',
    field_307_raw: [ 'profile_30' ],
    field_315: '<span class="5fbd6688490f05001bc6d819">TNU Services - Intelcom</span>',
    field_315_raw: [
      {
        id: '5fbd6688490f05001bc6d819',
        identifier: 'TNU Services - Intelcom'
      }
    ],
    field_320: '',
    field_318: '08/10/2022 11:41pm',
    field_318_raw: {
      date: '08/10/2022',
      date_formatted: '08/10/2022',
      hours: '11',
      minutes: '41',
      am_pm: 'PM',
      unix_timestamp: 1660174860000,
      iso_timestamp: '2022-08-10T23:41:00.000Z',
      timestamp: '08/10/2022 11:41 pm',
      time: 1421
    },
    field_720: '',
    field_1208: '',
    field_1220: '',
    field_1221: '',
    field_1222: '',
    field_1223: '',
    field_1224: '',
    field_1225: '',
    field_1226: '',
    field_1227: '',
    field_1228: '',
    field_1229: 'No',
    field_1229_raw: false,
    field_1230: '',
    field_1231: '',
    field_1231_raw: [],
    field_1232: '',
    field_1233: '',
    field_1234: '',
    field_1235: '',
    field_1236: '',
    field_1237: '',
    field_1238: '',
    field_1238_raw: '',
    field_1241: 'No',
    field_1241_raw: false,
    field_1253: 0,
    field_1253_raw: 0,
    field_1342: 'No',
    field_1342_raw: false,
    field_1373: '',
    field_1547: 'No',
    field_1547_raw: false,
    field_1546: '',
    field_1588: 'Yes',
    field_1588_raw: true,
    field_1899: 3,
    field_1899_raw: 3,
    field_1900: 1,
    field_1900_raw: 1,
    field_1987: '',
    field_2093: '',
    field_2143: 'Fatima Diraya5503',
    field_2143_raw: 'Fatima Diraya5503',
    field_2248: '5503',
    field_2248_raw: '5503',
    field_2250: 'Fatima Diraya5503 - 5503',
    field_2250_raw: 'Fatima Diraya5503 - 5503'
  },
  level: 'info',
  timestamp: '2022-09-13T21:45:31.136Z'
}
{
  message: 'postUrl https://api.knack.com/v1/objects/object_30/records/6310bf783e06630021286d54 payload [object Object]',
  level: 'info',
  timestamp: '2022-09-13T21:45:31.137Z'
}
{
  message: { field_2248: '5503' },
  level: 'info',
  timestamp: '2022-09-13T21:45:31.137Z'
}
{
  message: {
    id: '6310bf783e06630021286d54',
    account_status: 'active',
    approval_status: 'approved',
    profile_keys: 'Worker',
    profile_keys_raw: [ { id: 'profile_30', identifier: 'Worker' } ],
    field_658: 122308,
    field_658_raw: 122308,
    field_659: 122508,
    field_659_raw: 122508,
    field_660: 'W-122508',
    field_660_raw: 'W-122508',
    field_303: 'Fatima Diraya5503',
    field_303_raw: {
      first: 'Fatima',
      last: 'Diraya5503',
      formatted_value: 'Fatima Diraya5503'
    },
    field_304: '',
    field_305: '',
    field_306: 'active',
    field_306_raw: 'active',
    field_307: '<span class="profile_30">Worker</span>',
    field_307_raw: [ 'profile_30' ],
    field_315: '<span class="5fbd6688490f05001bc6d819">TNU Services - Intelcom</span>',
    field_315_raw: [
      {
        id: '5fbd6688490f05001bc6d819',
        identifier: 'TNU Services - Intelcom'
      }
    ],
    field_320: '',
    field_318: '09/01/2022 10:19am',
    field_318_raw: {
      date: '09/01/2022',
      date_formatted: '09/01/2022',
      hours: '10',
      minutes: '19',
      am_pm: 'AM',
      unix_timestamp: 1662027540000,
      iso_timestamp: '2022-09-01T10:19:00.000Z',
      timestamp: '09/01/2022 10:19 am',
      time: 619
    },
    field_720: '',
    field_1208: '',
    field_1220: '',
    field_1221: '',
    field_1222: '',
    field_1223: '',
    field_1224: '',
    field_1225: '',
    field_1226: '',
    field_1227: '',
    field_1228: '',
    field_1229: 'No',
    field_1229_raw: false,
    field_1230: '',
    field_1231: '',
    field_1231_raw: [],
    field_1232: '',
    field_1233: '',
    field_1234: '',
    field_1235: '',
    field_1236: '',
    field_1237: '',
    field_1238: '',
    field_1238_raw: '',
    field_1241: 'No',
    field_1241_raw: false,
    field_1253: 0,
    field_1253_raw: 0,
    field_1342: 'No',
    field_1342_raw: false,
    field_1373: '',
    field_1547: 'No',
    field_1547_raw: false,
    field_1546: '',
    field_1588: 'Yes',
    field_1588_raw: true,
    field_1899: 0,
    field_1899_raw: 0,
    field_1900: 1,
    field_1900_raw: 1,
    field_1987: '',
    field_2093: '',
    field_2143: 'Fatima Diraya5503',
    field_2143_raw: 'Fatima Diraya5503',
    field_2248: '5503',
    field_2248_raw: '5503',
    field_2250: 'Fatima Diraya5503 - 5503',
    field_2250_raw: 'Fatima Diraya5503 - 5503'
  },
  level: 'info',
  timestamp: '2022-09-13T21:45:31.947Z'
}
{
  message: 'postUrl https://api.knack.com/v1/objects/object_30/records/6306f19286609e0021246ee2 payload [object Object]',
  level: 'info',
  timestamp: '2022-09-13T21:45:31.947Z'
}
{
  message: { field_2248: '5503' },
  level: 'info',
  timestamp: '2022-09-13T21:45:31.947Z'
}
{
  message: {
    id: '6306f19286609e0021246ee2',
    account_status: 'active',
    approval_status: 'approved',
    profile_keys: 'Worker',
    profile_keys_raw: [ { id: 'profile_30', identifier: 'Worker' } ],
    field_658: 121612,
    field_658_raw: 121612,
    field_659: 121812,
    field_659_raw: 121812,
    field_660: 'W-121812',
    field_660_raw: 'W-121812',
    field_303: 'Fatima Diraya5503',
    field_303_raw: {
      first: 'Fatima',
      last: 'Diraya5503',
      formatted_value: 'Fatima Diraya5503'
    },
    field_304: '',
    field_305: '',
    field_306: 'active',
    field_306_raw: 'active',
    field_307: '<span class="profile_30">Worker</span>',
    field_307_raw: [ 'profile_30' ],
    field_315: '<span class="5fbd6688490f05001bc6d819">TNU Services - Intelcom</span>',
    field_315_raw: [
      {
        id: '5fbd6688490f05001bc6d819',
        identifier: 'TNU Services - Intelcom'
      }
    ],
    field_320: '',
    field_318: '08/24/2022 11:50pm',
    field_318_raw: {
      date: '08/24/2022',
      date_formatted: '08/24/2022',
      hours: '11',
      minutes: '50',
      am_pm: 'PM',
      unix_timestamp: 1661385000000,
      iso_timestamp: '2022-08-24T23:50:00.000Z',
      timestamp: '08/24/2022 11:50 pm',
      time: 1430
    },
    field_720: '',
    field_1208: '',
    field_1220: '',
    field_1221: '',
    field_1222: '',
    field_1223: '',
    field_1224: '',
    field_1225: '',
    field_1226: '',
    field_1227: '',
    field_1228: '',
    field_1229: 'No',
    field_1229_raw: false,
    field_1230: '',
    field_1231: '',
    field_1231_raw: [],
    field_1232: '',
    field_1233: '',
    field_1234: '',
    field_1235: '',
    field_1236: '',
    field_1237: '',
    field_1238: '',
    field_1238_raw: '',
    field_1241: 'No',
    field_1241_raw: false,
    field_1253: 0,
    field_1253_raw: 0,
    field_1342: 'No',
    field_1342_raw: false,
    field_1373: '',
    field_1547: 'No',
    field_1547_raw: false,
    field_1546: '',
    field_1588: 'Yes',
    field_1588_raw: true,
    field_1899: 2,
    field_1899_raw: 2,
    field_1900: 1,
    field_1900_raw: 1,
    field_1987: '',
    field_2093: '',
    field_2143: 'Fatima Diraya5503',
    field_2143_raw: 'Fatima Diraya5503',
    field_2248: '5503',
    field_2248_raw: '5503',
    field_2250: 'Fatima Diraya5503 - 5503',
    field_2250_raw: 'Fatima Diraya5503 - 5503'
  },
  level: 'info',
  timestamp: '2022-09-13T21:45:32.845Z'
}
{
  message: 'postUrl https://api.knack.com/v1/objects/object_30/records/62eb2fb60fb417002140d731 payload [object Object]',
  level: 'info',
  timestamp: '2022-09-13T21:45:32.846Z'
}
{
  message: { field_2248: '5503' },
  level: 'info',
  timestamp: '2022-09-13T21:45:32.846Z'
}
{
  message: {
    id: '62eb2fb60fb417002140d731',
    account_status: 'active',
    approval_status: 'approved',
    profile_keys: 'Worker',
    profile_keys_raw: [ { id: 'profile_30', identifier: 'Worker' } ],
    field_658: 119375,
    field_658_raw: 119375,
    field_659: 119575,
    field_659_raw: 119575,
    field_660: 'W-119575',
    field_660_raw: 'W-119575',
    field_303: 'Fatima Diraya5503',
    field_303_raw: {
      first: 'Fatima',
      last: 'Diraya5503',
      formatted_value: 'Fatima Diraya5503'
    },
    field_304: '',
    field_305: '',
    field_306: 'active',
    field_306_raw: 'active',
    field_307: '<span class="profile_30">Worker</span>',
    field_307_raw: [ 'profile_30' ],
    field_315: '<span class="5fbd6688490f05001bc6d819">TNU Services - Intelcom</span>',
    field_315_raw: [
      {
        id: '5fbd6688490f05001bc6d819',
        identifier: 'TNU Services - Intelcom'
      }
    ],
    field_320: '',
    field_318: '08/03/2022 10:32pm',
    field_318_raw: {
      date: '08/03/2022',
      date_formatted: '08/03/2022',
      hours: '10',
      minutes: '32',
      am_pm: 'PM',
      unix_timestamp: 1659565920000,
      iso_timestamp: '2022-08-03T22:32:00.000Z',
      timestamp: '08/03/2022 10:32 pm',
      time: 1352
    },
    field_720: '',
    field_1208: '',
    field_1220: '',
    field_1221: '',
    field_1222: '',
    field_1223: '',
    field_1224: '',
    field_1225: '',
    field_1226: '',
    field_1227: '',
    field_1228: '',
    field_1229: 'No',
    field_1229_raw: false,
    field_1230: '',
    field_1231: '',
    field_1231_raw: [],
    field_1232: '',
    field_1233: '',
    field_1234: '',
    field_1235: '',
    field_1236: '',
    field_1237: '',
    field_1238: '',
    field_1238_raw: '',
    field_1241: 'No',
    field_1241_raw: false,
    field_1253: 0,
    field_1253_raw: 0,
    field_1342: 'No',
    field_1342_raw: false,
    field_1373: '',
    field_1547: 'No',
    field_1547_raw: false,
    field_1546: '',
    field_1588: 'Yes',
    field_1588_raw: true,
    field_1899: 9,
    field_1899_raw: 9,
    field_1900: 1,
    field_1900_raw: 1,
    field_1987: '',
    field_2093: '',
    field_2143: 'Fatima Diraya5503',
    field_2143_raw: 'Fatima Diraya5503',
    field_2248: '5503',
    field_2248_raw: '5503',
    field_2250: 'Fatima Diraya5503 - 5503',
    field_2250_raw: 'Fatima Diraya5503 - 5503'
  },
  level: 'info',
  timestamp: '2022-09-13T21:45:34.244Z'
}
{
  message: 'postUrl https://api.knack.com/v1/objects/object_30/records/62d9d3655137d30021c1fa1c payload [object Object]',
  level: 'info',
  timestamp: '2022-09-13T21:45:34.244Z'
}
{
  message: { field_2248: '8537' },
  level: 'info',
  timestamp: '2022-09-13T21:45:34.244Z'
}
{
  message: {
    id: '62d9d3655137d30021c1fa1c',
    account_status: 'active',
    approval_status: 'approved',
    profile_keys: 'Worker',
    profile_keys_raw: [ { id: 'profile_30', identifier: 'Worker' } ],
    field_658: 117848,
    field_658_raw: 117848,
    field_659: 118048,
    field_659_raw: 118048,
    field_660: 'W-118048',
    field_660_raw: 'W-118048',
    field_303: 'Taheni Egy8537',
    field_303_raw: {
      first: 'Taheni',
      last: 'Egy8537',
      formatted_value: 'Taheni Egy8537'
    },
    field_304: '',
    field_305: '*********',
    field_305_raw: '**********',
    field_306: 'active',
    field_306_raw: 'active',
    field_307: '<span class="profile_30">Worker</span>',
    field_307_raw: [ 'profile_30' ],
    field_315: '<span class="5fbd6688490f05001bc6d819">TNU Services - Intelcom</span>',
    field_315_raw: [
      {
        id: '5fbd6688490f05001bc6d819',
        identifier: 'TNU Services - Intelcom'
      }
    ],
    field_320: '<span class="5fbd673eb20d90001bb93d9b">Alexandre Khalifa Khalifa</span>',
    field_320_raw: [
      {
        id: '5fbd673eb20d90001bb93d9b',
        identifier: 'Alexandre Khalifa Khalifa'
      }
    ],
    field_318: '07/21/2022 6:29pm',
    field_318_raw: {
      date: '07/21/2022',
      date_formatted: '07/21/2022',
      hours: '06',
      minutes: '29',
      am_pm: 'PM',
      unix_timestamp: 1658428140000,
      iso_timestamp: '2022-07-21T18:29:00.000Z',
      timestamp: '07/21/2022 06:29 pm',
      time: 1109
    },
    field_720: '',
    field_1208: '',
    field_1220: '',
    field_1221: '',
    field_1222: '',
    field_1223: '',
    field_1224: '',
    field_1225: '',
    field_1226: '',
    field_1227: '',
    field_1228: '',
    field_1229: 'No',
    field_1229_raw: false,
    field_1230: '',
    field_1231: '',
    field_1231_raw: [],
    field_1232: '',
    field_1233: '',
    field_1234: '',
    field_1235: '',
    field_1236: '<span class="5bfecfdd31782f6061574545">Intelcom Courier Canada</span>',
    field_1236_raw: [
      {
        id: '5bfecfdd31782f6061574545',
        identifier: 'Intelcom Courier Canada'
      }
    ],
    field_1237: '',
    field_1238: '',
    field_1238_raw: '',
    field_1241: 'No',
    field_1241_raw: false,
    field_1253: 0,
    field_1253_raw: 0,
    field_1342: 'No',
    field_1342_raw: false,
    field_1373: '',
    field_1547: 'No',
    field_1547_raw: false,
    field_1546: '',
    field_1588: 'No',
    field_1588_raw: false,
    field_1899: 1,
    field_1899_raw: 1,
    field_1900: 0,
    field_1900_raw: 0,
    field_1987: '',
    field_1987_raw: [],
    field_2093: '',
    field_2143: 'Taheni Egy8537',
    field_2143_raw: 'Taheni Egy8537',
    field_2248: '8537',
    field_2248_raw: '8537',
    field_2250: 'Taheni Egy8537 - 8537',
    field_2250_raw: 'Taheni Egy8537 - 8537'
  },
  level: 'info',
  timestamp: '2022-09-13T21:45:34.980Z'
}
{
  message: 'postUrl https://api.knack.com/v1/objects/object_30/records/62eb2ff6c622a7002134af9d payload [object Object]',
  level: 'info',
  timestamp: '2022-09-13T21:45:34.981Z'
}
{
  message: { field_2248: '3636' },
  level: 'info',
  timestamp: '2022-09-13T21:45:34.981Z'
}
{
  message: {
    id: '62eb2ff6c622a7002134af9d',
    account_status: 'active',
    approval_status: 'approved',
    profile_keys: 'Worker',
    profile_keys_raw: [ { id: 'profile_30', identifier: 'Worker' } ],
    field_658: 119390,
    field_658_raw: 119390,
    field_659: 119590,
    field_659_raw: 119590,
    field_660: 'W-119590',
    field_660_raw: 'W-119590',
    field_303: 'Chams Ejbeli3636',
    field_303_raw: {
      first: 'Chams',
      last: 'Ejbeli3636',
      formatted_value: 'Chams Ejbeli3636'
    },
    field_304: '',
    field_305: '',
    field_306: 'active',
    field_306_raw: 'active',
    field_307: '<span class="profile_30">Worker</span>',
    field_307_raw: [ 'profile_30' ],
    field_315: '<span class="5fbd6688490f05001bc6d819">TNU Services - Intelcom</span>',
    field_315_raw: [
      {
        id: '5fbd6688490f05001bc6d819',
        identifier: 'TNU Services - Intelcom'
      }
    ],
    field_320: '',
    field_318: '08/03/2022 10:33pm',
    field_318_raw: {
      date: '08/03/2022',
      date_formatted: '08/03/2022',
      hours: '10',
      minutes: '33',
      am_pm: 'PM',
      unix_timestamp: 1659565980000,
      iso_timestamp: '2022-08-03T22:33:00.000Z',
      timestamp: '08/03/2022 10:33 pm',
      time: 1353
    },
    field_720: '',
    field_1208: '',
    field_1220: '',
    field_1221: '',
    field_1222: '',
    field_1223: '',
    field_1224: '',
    field_1225: '',
    field_1226: '',
    field_1227: '',
    field_1228: '',
    field_1229: 'No',
    field_1229_raw: false,
    field_1230: '',
    field_1231: '',
    field_1231_raw: [],
    field_1232: '',
    field_1233: '',
    field_1234: '',
    field_1235: '',
    field_1236: '',
    field_1237: '',
    field_1238: '',
    field_1238_raw: '',
    field_1241: 'No',
    field_1241_raw: false,
    field_1253: 0,
    field_1253_raw: 0,
    field_1342: 'No',
    field_1342_raw: false,
    field_1373: '',
    field_1547: 'No',
    field_1547_raw: false,
    field_1546: '',
    field_1588: 'Yes',
    field_1588_raw: true,
    field_1899: 4,
    field_1899_raw: 4,
    field_1900: 1,
    field_1900_raw: 1,
    field_1987: '',
    field_2093: '',
    field_2143: 'Chams Ejbeli3636',
    field_2143_raw: 'Chams Ejbeli3636',
    field_2248: '3636',
    field_2248_raw: '3636',
    field_2250: 'Chams Ejbeli3636 - 3636',
    field_2250_raw: 'Chams Ejbeli3636 - 3636'
  },
  level: 'info',
  timestamp: '2022-09-13T21:45:36.380Z'
}
{
  message: 'postUrl https://api.knack.com/v1/objects/object_30/records/62d991b9a43dc900217fa93f payload [object Object]',
  level: 'info',
  timestamp: '2022-09-13T21:45:36.381Z'
}
{
  message: { field_2248: '3636' },
  level: 'info',
  timestamp: '2022-09-13T21:45:36.381Z'
}
{
  message: {
    id: '62d991b9a43dc900217fa93f',
    account_status: 'active',
    approval_status: 'approved',
    profile_keys: 'Worker',
    profile_keys_raw: [ { id: 'profile_30', identifier: 'Worker' } ],
    field_658: 117812,
    field_658_raw: 117812,
    field_659: 118012,
    field_659_raw: 118012,
    field_660: 'W-118012',
    field_660_raw: 'W-118012',
    field_303: 'chams ejbeli3636',
    field_303_raw: {
      first: 'chams',
      last: 'ejbeli3636',
      formatted_value: 'chams ejbeli3636'
    },
    field_304: '',
    field_305: '*********',
    field_305_raw: '**********',
    field_306: 'active',
    field_306_raw: 'active',
    field_307: '<span class="profile_30">Worker</span>',
    field_307_raw: [ 'profile_30' ],
    field_315: '<span class="5fbd6688490f05001bc6d819">TNU Services - Intelcom</span>',
    field_315_raw: [
      {
        id: '5fbd6688490f05001bc6d819',
        identifier: 'TNU Services - Intelcom'
      }
    ],
    field_320: '<span class="5fbd673eb20d90001bb93d9b">Alexandre Khalifa Khalifa</span>',
    field_320_raw: [
      {
        id: '5fbd673eb20d90001bb93d9b',
        identifier: 'Alexandre Khalifa Khalifa'
      }
    ],
    field_318: '07/21/2022 1:49pm',
    field_318_raw: {
      date: '07/21/2022',
      date_formatted: '07/21/2022',
      hours: '01',
      minutes: '49',
      am_pm: 'PM',
      unix_timestamp: 1658411340000,
      iso_timestamp: '2022-07-21T13:49:00.000Z',
      timestamp: '07/21/2022 01:49 pm',
      time: 829
    },
    field_720: '',
    field_1208: '',
    field_1220: '',
    field_1221: '',
    field_1222: '',
    field_1223: '',
    field_1224: '',
    field_1225: '',
    field_1226: '',
    field_1227: '',
    field_1228: '',
    field_1229: 'No',
    field_1229_raw: false,
    field_1230: '',
    field_1231: '',
    field_1231_raw: [],
    field_1232: '',
    field_1233: '',
    field_1234: '',
    field_1235: '',
    field_1236: '<span class="5bfecfdd31782f6061574545">Intelcom Courier Canada</span>',
    field_1236_raw: [
      {
        id: '5bfecfdd31782f6061574545',
        identifier: 'Intelcom Courier Canada'
      }
    ],
    field_1237: '',
    field_1238: '',
    field_1238_raw: '',
    field_1241: 'No',
    field_1241_raw: false,
    field_1253: 0,
    field_1253_raw: 0,
    field_1342: 'No',
    field_1342_raw: false,
    field_1373: '',
    field_1547: 'No',
    field_1547_raw: false,
    field_1546: '',
    field_1588: 'No',
    field_1588_raw: false,
    field_1899: 12,
    field_1899_raw: 12,
    field_1900: 0,
    field_1900_raw: 0,
    field_1987: '',
    field_1987_raw: [],
    field_2093: '',
    field_2143: 'chams ejbeli3636',
    field_2143_raw: 'chams ejbeli3636',
    field_2248: '3636',
    field_2248_raw: '3636',
    field_2250: 'chams ejbeli3636 - 3636',
    field_2250_raw: 'chams ejbeli3636 - 3636'
  },
  level: 'info',
  timestamp: '2022-09-13T21:45:37.299Z'
}
{
  message: 'postUrl https://api.knack.com/v1/objects/object_30/records/62fda5ea6d475b00219e8c9f payload [object Object]',
  level: 'info',
  timestamp: '2022-09-13T21:45:37.299Z'
}
{
  message: { field_2248: '3636' },
  level: 'info',
  timestamp: '2022-09-13T21:45:37.299Z'
}
{
  message: {
    id: '62fda5ea6d475b00219e8c9f',
    account_status: 'active',
    approval_status: 'approved',
    profile_keys: 'Worker',
    profile_keys_raw: [ { id: 'profile_30', identifier: 'Worker' } ],
    field_658: 120924,
    field_658_raw: 120924,
    field_659: 121124,
    field_659_raw: 121124,
    field_660: 'W-121124',
    field_660_raw: 'W-121124',
    field_303: 'Chams Ejbeli3636',
    field_303_raw: {
      first: 'Chams',
      last: 'Ejbeli3636',
      formatted_value: 'Chams Ejbeli3636'
    },
    field_304: '',
    field_305: '',
    field_306: 'active',
    field_306_raw: 'active',
    field_307: '<span class="profile_30">Worker</span>',
    field_307_raw: [ 'profile_30' ],
    field_315: '<span class="5fbd6688490f05001bc6d819">TNU Services - Intelcom</span>',
    field_315_raw: [
      {
        id: '5fbd6688490f05001bc6d819',
        identifier: 'TNU Services - Intelcom'
      }
    ],
    field_320: '',
    field_318: '08/17/2022 10:37pm',
    field_318_raw: {
      date: '08/17/2022',
      date_formatted: '08/17/2022',
      hours: '10',
      minutes: '37',
      am_pm: 'PM',
      unix_timestamp: 1660775820000,
      iso_timestamp: '2022-08-17T22:37:00.000Z',
      timestamp: '08/17/2022 10:37 pm',
      time: 1357
    },
    field_720: '',
    field_1208: '',
    field_1220: '',
    field_1221: '',
    field_1222: '',
    field_1223: '',
    field_1224: '',
    field_1225: '',
    field_1226: '',
    field_1227: '',
    field_1228: '',
    field_1229: 'No',
    field_1229_raw: false,
    field_1230: '',
    field_1231: '',
    field_1231_raw: [],
    field_1232: '',
    field_1233: '',
    field_1234: '',
    field_1235: '',
    field_1236: '',
    field_1237: '',
    field_1238: '',
    field_1238_raw: '',
    field_1241: 'No',
    field_1241_raw: false,
    field_1253: 0,
    field_1253_raw: 0,
    field_1342: 'No',
    field_1342_raw: false,
    field_1373: '',
    field_1547: 'No',
    field_1547_raw: false,
    field_1546: '',
    field_1588: 'Yes',
    field_1588_raw: true,
    field_1899: 1,
    field_1899_raw: 1,
    field_1900: 1,
    field_1900_raw: 1,
    field_1987: '',
    field_2093: '',
    field_2143: 'Chams Ejbeli3636',
    field_2143_raw: 'Chams Ejbeli3636',
    field_2248: '3636',
    field_2248_raw: '3636',
    field_2250: 'Chams Ejbeli3636 - 3636',
    field_2250_raw: 'Chams Ejbeli3636 - 3636'
  },
  level: 'info',
  timestamp: '2022-09-13T21:45:38.303Z'
}
{
  message: 'postUrl https://api.knack.com/v1/objects/object_30/records/6306f19f1aeb0b00215f4108 payload [object Object]',
  level: 'info',
  timestamp: '2022-09-13T21:45:38.304Z'
}
{
  message: { field_2248: '3636' },
  level: 'info',
  timestamp: '2022-09-13T21:45:38.304Z'
}
{
  message: {
    id: '6306f19f1aeb0b00215f4108',
    account_status: 'active',
    approval_status: 'approved',
    profile_keys: 'Worker',
    profile_keys_raw: [ { id: 'profile_30', identifier: 'Worker' } ],
    field_658: 121616,
    field_658_raw: 121616,
    field_659: 121816,
    field_659_raw: 121816,
    field_660: 'W-121816',
    field_660_raw: 'W-121816',
    field_303: 'Chams Ejbeli3636',
    field_303_raw: {
      first: 'Chams',
      last: 'Ejbeli3636',
      formatted_value: 'Chams Ejbeli3636'
    },
    field_304: '',
    field_305: '',
    field_306: 'active',
    field_306_raw: 'active',
    field_307: '<span class="profile_30">Worker</span>',
    field_307_raw: [ 'profile_30' ],
    field_315: '<span class="5fbd6688490f05001bc6d819">TNU Services - Intelcom</span>',
    field_315_raw: [
      {
        id: '5fbd6688490f05001bc6d819',
        identifier: 'TNU Services - Intelcom'
      }
    ],
    field_320: '',
    field_318: '08/24/2022 11:50pm',
    field_318_raw: {
      date: '08/24/2022',
      date_formatted: '08/24/2022',
      hours: '11',
      minutes: '50',
      am_pm: 'PM',
      unix_timestamp: 1661385000000,
      iso_timestamp: '2022-08-24T23:50:00.000Z',
      timestamp: '08/24/2022 11:50 pm',
      time: 1430
    },
    field_720: '',
    field_1208: '',
    field_1220: '',
    field_1221: '',
    field_1222: '',
    field_1223: '',
    field_1224: '',
    field_1225: '',
    field_1226: '',
    field_1227: '',
    field_1228: '',
    field_1229: 'No',
    field_1229_raw: false,
    field_1230: '',
    field_1231: '',
    field_1231_raw: [],
    field_1232: '',
    field_1233: '',
    field_1234: '',
    field_1235: '',
    field_1236: '',
    field_1237: '',
    field_1238: '',
    field_1238_raw: '',
    field_1241: 'No',
    field_1241_raw: false,
    field_1253: 0,
    field_1253_raw: 0,
    field_1342: 'No',
    field_1342_raw: false,
    field_1373: '',
    field_1547: 'No',
    field_1547_raw: false,
    field_1546: '',
    field_1588: 'Yes',
    field_1588_raw: true,
    field_1899: 0,
    field_1899_raw: 0,
    field_1900: 1,
    field_1900_raw: 1,
    field_1987: '',
    field_2093: '',
    field_2143: 'Chams Ejbeli3636',
    field_2143_raw: 'Chams Ejbeli3636',
    field_2248: '3636',
    field_2248_raw: '3636',
    field_2250: 'Chams Ejbeli3636 - 3636',
    field_2250_raw: 'Chams Ejbeli3636 - 3636'
  },
  level: 'info',
  timestamp: '2022-09-13T21:45:39.011Z'
}
{
  message: 'postUrl https://api.knack.com/v1/objects/object_30/records/62ec1415707b450024adac81 payload [object Object]',
  level: 'info',
  timestamp: '2022-09-13T21:45:39.012Z'
}
{
  message: { field_2248: '2471' },
  level: 'info',
  timestamp: '2022-09-13T21:45:39.012Z'
}
{
  message: {
    id: '62ec1415707b450024adac81',
    account_status: 'active',
    approval_status: 'approved',
    profile_keys: 'Worker',
    profile_keys_raw: [ { id: 'profile_30', identifier: 'Worker' } ],
    field_658: 119716,
    field_658_raw: 119716,
    field_659: 119916,
    field_659_raw: 119916,
    field_660: 'W-119916',
    field_660_raw: 'W-119916',
    field_303: 'Bilel  Garbouji2471',
    field_303_raw: {
      first: 'Bilel ',
      last: 'Garbouji2471',
      formatted_value: 'Bilel  Garbouji2471'
    },
    field_304: '',
    field_305: '*********',
    field_305_raw: '**********',
    field_306: 'active',
    field_306_raw: 'active',
    field_307: '<span class="profile_30">Worker</span>',
    field_307_raw: [ 'profile_30' ],
    field_315: '<span class="5fbd6688490f05001bc6d819">TNU Services - Intelcom</span>',
    field_315_raw: [
      {
        id: '5fbd6688490f05001bc6d819',
        identifier: 'TNU Services - Intelcom'
      }
    ],
    field_320: '<span class="5fbd673eb20d90001bb93d9b">Alexandre Khalifa Khalifa</span>',
    field_320_raw: [
      {
        id: '5fbd673eb20d90001bb93d9b',
        identifier: 'Alexandre Khalifa Khalifa'
      }
    ],
    field_318: '08/04/2022 2:46pm',
    field_318_raw: {
      date: '08/04/2022',
      date_formatted: '08/04/2022',
      hours: '02',
      minutes: '46',
      am_pm: 'PM',
      unix_timestamp: 1659624360000,
      iso_timestamp: '2022-08-04T14:46:00.000Z',
      timestamp: '08/04/2022 02:46 pm',
      time: 886
    },
    field_720: '',
    field_1208: '',
    field_1220: '',
    field_1221: '',
    field_1222: '',
    field_1223: '',
    field_1224: '',
    field_1225: '',
    field_1226: '',
    field_1227: '',
    field_1228: '',
    field_1229: 'No',
    field_1229_raw: false,
    field_1230: '',
    field_1231: '',
    field_1231_raw: [],
    field_1232: '',
    field_1233: '',
    field_1234: '',
    field_1235: '',
    field_1236: '<span class="5bfecfdd31782f6061574545">Intelcom Courier Canada</span>',
    field_1236_raw: [
      {
        id: '5bfecfdd31782f6061574545',
        identifier: 'Intelcom Courier Canada'
      }
    ],
    field_1237: '',
    field_1238: '',
    field_1238_raw: '',
    field_1241: 'No',
    field_1241_raw: false,
    field_1253: 0,
    field_1253_raw: 0,
    field_1342: 'No',
    field_1342_raw: false,
    field_1373: '',
    field_1547: 'No',
    field_1547_raw: false,
    field_1546: '',
    field_1588: 'No',
    field_1588_raw: false,
    field_1899: 5,
    field_1899_raw: 5,
    field_1900: 0,
    field_1900_raw: 0,
    field_1987: '',
    field_1987_raw: [],
    field_2093: '',
    field_2143: 'Bilel  Garbouji2471',
    field_2143_raw: 'Bilel  Garbouji2471',
    field_2248: '2471',
    field_2248_raw: '2471',
    field_2250: 'Bilel  Garbouji2471 - 2471',
    field_2250_raw: 'Bilel  Garbouji2471 - 2471'
  },
  level: 'info',
  timestamp: '2022-09-13T21:45:39.896Z'
}
{
  message: 'postUrl https://api.knack.com/v1/objects/object_30/records/62d9977667864b00218e3c9d payload [object Object]',
  level: 'info',
  timestamp: '2022-09-13T21:45:39.896Z'
}
{
  message: { field_2248: '3316' },
  level: 'info',
  timestamp: '2022-09-13T21:45:39.896Z'
}
{
  message: {
    id: '62d9977667864b00218e3c9d',
    account_status: 'active',
    approval_status: 'approved',
    profile_keys: 'Worker',
    profile_keys_raw: [ { id: 'profile_30', identifier: 'Worker' } ],
    field_658: 117830,
    field_658_raw: 117830,
    field_659: 118030,
    field_659_raw: 118030,
    field_660: 'W-118030',
    field_660_raw: 'W-118030',
    field_303: 'medard gemini3316',
    field_303_raw: {
      first: 'medard',
      last: 'gemini3316',
      formatted_value: 'medard gemini3316'
    },
    field_304: '',
    field_305: '*********',
    field_305_raw: '**********',
    field_306: 'active',
    field_306_raw: 'active',
    field_307: '<span class="profile_30">Worker</span>',
    field_307_raw: [ 'profile_30' ],
    field_315: '<span class="5fbd6688490f05001bc6d819">TNU Services - Intelcom</span>',
    field_315_raw: [
      {
        id: '5fbd6688490f05001bc6d819',
        identifier: 'TNU Services - Intelcom'
      }
    ],
    field_320: '<span class="5fbd673eb20d90001bb93d9b">Alexandre Khalifa Khalifa</span>',
    field_320_raw: [
      {
        id: '5fbd673eb20d90001bb93d9b',
        identifier: 'Alexandre Khalifa Khalifa'
      }
    ],
    field_318: '07/21/2022 2:14pm',
    field_318_raw: {
      date: '07/21/2022',
      date_formatted: '07/21/2022',
      hours: '02',
      minutes: '14',
      am_pm: 'PM',
      unix_timestamp: 1658412840000,
      iso_timestamp: '2022-07-21T14:14:00.000Z',
      timestamp: '07/21/2022 02:14 pm',
      time: 854
    },
    field_720: '',
    field_1208: '',
    field_1220: '',
    field_1221: '',
    field_1222: '',
    field_1223: '',
    field_1224: '',
    field_1225: '',
    field_1226: '',
    field_1227: '',
    field_1228: '',
    field_1229: 'No',
    field_1229_raw: false,
    field_1230: '',
    field_1231: '',
    field_1231_raw: [],
    field_1232: '',
    field_1233: '',
    field_1234: '',
    field_1235: '',
    field_1236: '<span class="5bfecfdd31782f6061574545">Intelcom Courier Canada</span>',
    field_1236_raw: [
      {
        id: '5bfecfdd31782f6061574545',
        identifier: 'Intelcom Courier Canada'
      }
    ],
    field_1237: '',
    field_1238: '',
    field_1238_raw: '',
    field_1241: 'No',
    field_1241_raw: false,
    field_1253: 0,
    field_1253_raw: 0,
    field_1342: 'No',
    field_1342_raw: false,
    field_1373: '',
    field_1547: 'No',
    field_1547_raw: false,
    field_1546: '',
    field_1588: 'No',
    field_1588_raw: false,
    field_1899: 19,
    field_1899_raw: 19,
    field_1900: 0,
    field_1900_raw: 0,
    field_1987: '',
    field_1987_raw: [],
    field_2093: '',
    field_2143: 'medard gemini3316',
    field_2143_raw: 'medard gemini3316',
    field_2248: '3316',
    field_2248_raw: '3316',
    field_2250: 'medard gemini3316 - 3316',
    field_2250_raw: 'medard gemini3316 - 3316'
  },
  level: 'info',
  timestamp: '2022-09-13T21:45:40.578Z'
}
{
  message: 'postUrl https://api.knack.com/v1/objects/object_30/records/62eb2f10859cd5002243c0e5 payload [object Object]',
  level: 'info',
  timestamp: '2022-09-13T21:45:40.578Z'
}
{
  message: { field_2248: '3316' },
  level: 'info',
  timestamp: '2022-09-13T21:45:40.578Z'
}
{
  message: {
    id: '62eb2f10859cd5002243c0e5',
    account_status: 'active',
    approval_status: 'approved',
    profile_keys: 'Worker',
    profile_keys_raw: [ { id: 'profile_30', identifier: 'Worker' } ],
    field_658: 119335,
    field_658_raw: 119335,
    field_659: 119535,
    field_659_raw: 119535,
    field_660: 'W-119535',
    field_660_raw: 'W-119535',
    field_303: 'Medard Gemini3316',
    field_303_raw: {
      first: 'Medard',
      last: 'Gemini3316',
      formatted_value: 'Medard Gemini3316'
    },
    field_304: '',
    field_305: '',
    field_306: 'active',
    field_306_raw: 'active',
    field_307: '<span class="profile_30">Worker</span>',
    field_307_raw: [ 'profile_30' ],
    field_315: '<span class="5fbd6688490f05001bc6d819">TNU Services - Intelcom</span>',
    field_315_raw: [
      {
        id: '5fbd6688490f05001bc6d819',
        identifier: 'TNU Services - Intelcom'
      }
    ],
    field_320: '',
    field_318: '08/03/2022 10:29pm',
    field_318_raw: {
      date: '08/03/2022',
      date_formatted: '08/03/2022',
      hours: '10',
      minutes: '29',
      am_pm: 'PM',
      unix_timestamp: 1659565740000,
      iso_timestamp: '2022-08-03T22:29:00.000Z',
      timestamp: '08/03/2022 10:29 pm',
      time: 1349
    },
    field_720: '',
    field_1208: '',
    field_1220: '',
    field_1221: '',
    field_1222: '',
    field_1223: '',
    field_1224: '',
    field_1225: '',
    field_1226: '',
    field_1227: '',
    field_1228: '',
    field_1229: 'No',
    field_1229_raw: false,
    field_1230: '',
    field_1231: '',
    field_1231_raw: [],
    field_1232: '',
    field_1233: '',
    field_1234: '',
    field_1235: '',
    field_1236: '',
    field_1237: '',
    field_1238: '',
    field_1238_raw: '',
    field_1241: 'No',
    field_1241_raw: false,
    field_1253: 0,
    field_1253_raw: 0,
    field_1342: 'No',
    field_1342_raw: false,
    field_1373: '',
    field_1547: 'No',
    field_1547_raw: false,
    field_1546: '',
    field_1588: 'Yes',
    field_1588_raw: true,
    field_1899: 11,
    field_1899_raw: 11,
    field_1900: 1,
    field_1900_raw: 1,
    field_1987: '',
    field_2093: '',
    field_2143: 'Medard Gemini3316',
    field_2143_raw: 'Medard Gemini3316',
    field_2248: '3316',
    field_2248_raw: '3316',
    field_2250: 'Medard Gemini3316 - 3316',
    field_2250_raw: 'Medard Gemini3316 - 3316'
  },
  level: 'info',
  timestamp: '2022-09-13T21:45:42.399Z'
}
{
  message: 'postUrl https://api.knack.com/v1/objects/object_30/records/62fda5086458150022178e6a payload [object Object]',
  level: 'info',
  timestamp: '2022-09-13T21:45:42.399Z'
}
{
  message: { field_2248: '3316' },
  level: 'info',
  timestamp: '2022-09-13T21:45:42.399Z'
}
{
  message: {
    id: '62fda5086458150022178e6a',
    account_status: 'active',
    approval_status: 'approved',
    profile_keys: 'Worker',
    profile_keys_raw: [ { id: 'profile_30', identifier: 'Worker' } ],
    field_658: 120873,
    field_658_raw: 120873,
    field_659: 121073,
    field_659_raw: 121073,
    field_660: 'W-121073',
    field_660_raw: 'W-121073',
    field_303: 'Medard Gemini3316',
    field_303_raw: {
      first: 'Medard',
      last: 'Gemini3316',
      formatted_value: 'Medard Gemini3316'
    },
    field_304: '',
    field_305: '',
    field_306: 'active',
    field_306_raw: 'active',
    field_307: '<span class="profile_30">Worker</span>',
    field_307_raw: [ 'profile_30' ],
    field_315: '<span class="5fbd6688490f05001bc6d819">TNU Services - Intelcom</span>',
    field_315_raw: [
      {
        id: '5fbd6688490f05001bc6d819',
        identifier: 'TNU Services - Intelcom'
      }
    ],
    field_320: '',
    field_318: '08/17/2022 10:33pm',
    field_318_raw: {
      date: '08/17/2022',
      date_formatted: '08/17/2022',
      hours: '10',
      minutes: '33',
      am_pm: 'PM',
      unix_timestamp: 1660775580000,
      iso_timestamp: '2022-08-17T22:33:00.000Z',
      timestamp: '08/17/2022 10:33 pm',
      time: 1353
    },
    field_720: '',
    field_1208: '',
    field_1220: '',
    field_1221: '',
    field_1222: '',
    field_1223: '',
    field_1224: '',
    field_1225: '',
    field_1226: '',
    field_1227: '',
    field_1228: '',
    field_1229: 'No',
    field_1229_raw: false,
    field_1230: '',
    field_1231: '',
    field_1231_raw: [],
    field_1232: '',
    field_1233: '',
    field_1234: '',
    field_1235: '',
    field_1236: '',
    field_1237: '',
    field_1238: '',
    field_1238_raw: '',
    field_1241: 'No',
    field_1241_raw: false,
    field_1253: 0,
    field_1253_raw: 0,
    field_1342: 'No',
    field_1342_raw: false,
    field_1373: '',
    field_1547: 'No',
    field_1547_raw: false,
    field_1546: '',
    field_1588: 'Yes',
    field_1588_raw: true,
    field_1899: 4,
    field_1899_raw: 4,
    field_1900: 1,
    field_1900_raw: 1,
    field_1987: '',
    field_2093: '',
    field_2143: 'Medard Gemini3316',
    field_2143_raw: 'Medard Gemini3316',
    field_2248: '3316',
    field_2248_raw: '3316',
    field_2250: 'Medard Gemini3316 - 3316',
    field_2250_raw: 'Medard Gemini3316 - 3316'
  },
  level: 'info',
  timestamp: '2022-09-13T21:45:43.541Z'
}
{
  message: 'postUrl https://api.knack.com/v1/objects/object_30/records/6306f14395fbb800240a10e4 payload [object Object]',
  level: 'info',
  timestamp: '2022-09-13T21:45:43.543Z'
}
{
  message: { field_2248: '3316' },
  level: 'info',
  timestamp: '2022-09-13T21:45:43.543Z'
}
{
  message: {
    id: '6306f14395fbb800240a10e4',
    account_status: 'active',
    approval_status: 'approved',
    profile_keys: 'Worker',
    profile_keys_raw: [ { id: 'profile_30', identifier: 'Worker' } ],
    field_658: 121596,
    field_658_raw: 121596,
    field_659: 121796,
    field_659_raw: 121796,
    field_660: 'W-121796',
    field_660_raw: 'W-121796',
    field_303: 'Medard Gemini3316',
    field_303_raw: {
      first: 'Medard',
      last: 'Gemini3316',
      formatted_value: 'Medard Gemini3316'
    },
    field_304: '',
    field_305: '',
    field_306: 'active',
    field_306_raw: 'active',
    field_307: '<span class="profile_30">Worker</span>',
    field_307_raw: [ 'profile_30' ],
    field_315: '<span class="5fbd6688490f05001bc6d819">TNU Services - Intelcom</span>',
    field_315_raw: [
      {
        id: '5fbd6688490f05001bc6d819',
        identifier: 'TNU Services - Intelcom'
      }
    ],
    field_320: '',
    field_318: '08/24/2022 11:49pm',
    field_318_raw: {
      date: '08/24/2022',
      date_formatted: '08/24/2022',
      hours: '11',
      minutes: '49',
      am_pm: 'PM',
      unix_timestamp: 1661384940000,
      iso_timestamp: '2022-08-24T23:49:00.000Z',
      timestamp: '08/24/2022 11:49 pm',
      time: 1429
    },
    field_720: '',
    field_1208: '',
    field_1220: '',
    field_1221: '',
    field_1222: '',
    field_1223: '',
    field_1224: '',
    field_1225: '',
    field_1226: '',
    field_1227: '',
    field_1228: '',
    field_1229: 'No',
    field_1229_raw: false,
    field_1230: '',
    field_1231: '',
    field_1231_raw: [],
    field_1232: '',
    field_1233: '',
    field_1234: '',
    field_1235: '',
    field_1236: '',
    field_1237: '',
    field_1238: '',
    field_1238_raw: '',
    field_1241: 'No',
    field_1241_raw: false,
    field_1253: 0,
    field_1253_raw: 0,
    field_1342: 'No',
    field_1342_raw: false,
    field_1373: '',
    field_1547: 'No',
    field_1547_raw: false,
    field_1546: '',
    field_1588: 'Yes',
    field_1588_raw: true,
    field_1899: 3,
    field_1899_raw: 3,
    field_1900: 1,
    field_1900_raw: 1,
    field_1987: '',
    field_2093: '',
    field_2143: 'Medard Gemini3316',
    field_2143_raw: 'Medard Gemini3316',
    field_2248: '3316',
    field_2248_raw: '3316',
    field_2250: 'Medard Gemini3316 - 3316',
    field_2250_raw: 'Medard Gemini3316 - 3316'
  },
  level: 'info',
  timestamp: '2022-09-13T21:45:45.264Z'
}
{
  message: 'postUrl https://api.knack.com/v1/objects/object_30/records/6310be9a9ac7d400211285ce payload [object Object]',
  level: 'info',
  timestamp: '2022-09-13T21:45:45.264Z'
}
{
  message: { field_2248: '3316' },
  level: 'info',
  timestamp: '2022-09-13T21:45:45.264Z'
}
{
  message: {
    id: '6310be9a9ac7d400211285ce',
    account_status: 'active',
    approval_status: 'approved',
    profile_keys: 'Worker',
    profile_keys_raw: [ { id: 'profile_30', identifier: 'Worker' } ],
    field_658: 122273,
    field_658_raw: 122273,
    field_659: 122473,
    field_659_raw: 122473,
    field_660: 'W-122473',
    field_660_raw: 'W-122473',
    field_303: 'Medard Gemini3316',
    field_303_raw: {
      first: 'Medard',
      last: 'Gemini3316',
      formatted_value: 'Medard Gemini3316'
    },
    field_304: '',
    field_305: '',
    field_306: 'active',
    field_306_raw: 'active',
    field_307: '<span class="profile_30">Worker</span>',
    field_307_raw: [ 'profile_30' ],
    field_315: '<span class="5fbd6688490f05001bc6d819">TNU Services - Intelcom</span>',
    field_315_raw: [
      {
        id: '5fbd6688490f05001bc6d819',
        identifier: 'TNU Services - Intelcom'
      }
    ],
    field_320: '',
    field_318: '09/01/2022 10:15am',
    field_318_raw: {
      date: '09/01/2022',
      date_formatted: '09/01/2022',
      hours: '10',
      minutes: '15',
      am_pm: 'AM',
      unix_timestamp: 1662027300000,
      iso_timestamp: '2022-09-01T10:15:00.000Z',
      timestamp: '09/01/2022 10:15 am',
      time: 615
    },
    field_720: '',
    field_1208: '',
    field_1220: '',
    field_1221: '',
    field_1222: '',
    field_1223: '',
    field_1224: '',
    field_1225: '',
    field_1226: '',
    field_1227: '',
    field_1228: '',
    field_1229: 'No',
    field_1229_raw: false,
    field_1230: '',
    field_1231: '',
    field_1231_raw: [],
    field_1232: '',
    field_1233: '',
    field_1234: '',
    field_1235: '',
    field_1236: '',
    field_1237: '',
    field_1238: '',
    field_1238_raw: '',
    field_1241: 'No',
    field_1241_raw: false,
    field_1253: 0,
    field_1253_raw: 0,
    field_1342: 'No',
    field_1342_raw: false,
    field_1373: '',
    field_1547: 'No',
    field_1547_raw: false,
    field_1546: '',
    field_1588: 'Yes',
    field_1588_raw: true,
    field_1899: 1,
    field_1899_raw: 1,
    field_1900: 1,
    field_1900_raw: 1,
    field_1987: '',
    field_2093: '',
    field_2143: 'Medard Gemini3316',
    field_2143_raw: 'Medard Gemini3316',
    field_2248: '3316',
    field_2248_raw: '3316',
    field_2250: 'Medard Gemini3316 - 3316',
    field_2250_raw: 'Medard Gemini3316 - 3316'
  },
  level: 'info',
  timestamp: '2022-09-13T21:45:46.386Z'
}
{
  message: 'postUrl https://api.knack.com/v1/objects/object_30/records/62d9da4c5137d30021c20834 payload [object Object]',
  level: 'info',
  timestamp: '2022-09-13T21:45:46.386Z'
}
{
  message: { field_2248: '2670' },
  level: 'info',
  timestamp: '2022-09-13T21:45:46.386Z'
}
{
  message: {
    id: '62d9da4c5137d30021c20834',
    account_status: 'active',
    approval_status: 'approved',
    profile_keys: 'Worker',
    profile_keys_raw: [ { id: 'profile_30', identifier: 'Worker' } ],
    field_658: 117851,
    field_658_raw: 117851,
    field_659: 118051,
    field_659_raw: 118051,
    field_660: 'W-118051',
    field_660_raw: 'W-118051',
    field_303: 'Mohamed Ghofrane2670',
    field_303_raw: {
      first: 'Mohamed',
      last: 'Ghofrane2670',
      formatted_value: 'Mohamed Ghofrane2670'
    },
    field_304: '',
    field_305: '*********',
    field_305_raw: '**********',
    field_306: 'active',
    field_306_raw: 'active',
    field_307: '<span class="profile_30">Worker</span>',
    field_307_raw: [ 'profile_30' ],
    field_315: '<span class="5fbd6688490f05001bc6d819">TNU Services - Intelcom</span>',
    field_315_raw: [
      {
        id: '5fbd6688490f05001bc6d819',
        identifier: 'TNU Services - Intelcom'
      }
    ],
    field_320: '<span class="5fbd673eb20d90001bb93d9b">Alexandre Khalifa Khalifa</span>',
    field_320_raw: [
      {
        id: '5fbd673eb20d90001bb93d9b',
        identifier: 'Alexandre Khalifa Khalifa'
      }
    ],
    field_318: '07/21/2022 6:59pm',
    field_318_raw: {
      date: '07/21/2022',
      date_formatted: '07/21/2022',
      hours: '06',
      minutes: '59',
      am_pm: 'PM',
      unix_timestamp: 1658429940000,
      iso_timestamp: '2022-07-21T18:59:00.000Z',
      timestamp: '07/21/2022 06:59 pm',
      time: 1139
    },
    field_720: '',
    field_1208: '',
    field_1220: '',
    field_1221: '',
    field_1222: '',
    field_1223: '',
    field_1224: '',
    field_1225: '',
    field_1226: '',
    field_1227: '',
    field_1228: '',
    field_1229: 'No',
    field_1229_raw: false,
    field_1230: '',
    field_1231: '',
    field_1231_raw: [],
    field_1232: '',
    field_1233: '',
    field_1234: '',
    field_1235: '',
    field_1236: '<span class="5bfecfdd31782f6061574545">Intelcom Courier Canada</span>',
    field_1236_raw: [
      {
        id: '5bfecfdd31782f6061574545',
        identifier: 'Intelcom Courier Canada'
      }
    ],
    field_1237: '',
    field_1238: '',
    field_1238_raw: '',
    field_1241: 'No',
    field_1241_raw: false,
    field_1253: 0,
    field_1253_raw: 0,
    field_1342: 'No',
    field_1342_raw: false,
    field_1373: '',
    field_1547: 'No',
    field_1547_raw: false,
    field_1546: '',
    field_1588: 'No',
    field_1588_raw: false,
    field_1899: 7,
    field_1899_raw: 7,
    field_1900: 0,
    field_1900_raw: 0,
    field_1987: '',
    field_1987_raw: [],
    field_2093: '',
    field_2143: 'Mohamed Ghofrane2670',
    field_2143_raw: 'Mohamed Ghofrane2670',
    field_2248: '2670',
    field_2248_raw: '2670',
    field_2250: 'Mohamed Ghofrane2670 - 2670',
    field_2250_raw: 'Mohamed Ghofrane2670 - 2670'
  },
  level: 'info',
  timestamp: '2022-09-13T21:45:47.386Z'
}
{
  message: 'postUrl https://api.knack.com/v1/objects/object_30/records/62e202f1ccd3f400216f8316 payload [object Object]',
  level: 'info',
  timestamp: '2022-09-13T21:45:47.386Z'
}
{
  message: { field_2248: '2670' },
  level: 'info',
  timestamp: '2022-09-13T21:45:47.386Z'
}
{
  message: {
    id: '62e202f1ccd3f400216f8316',
    account_status: 'active',
    approval_status: 'approved',
    profile_keys: 'Worker',
    profile_keys_raw: [ { id: 'profile_30', identifier: 'Worker' } ],
    field_658: 118414,
    field_658_raw: 118414,
    field_659: 118614,
    field_659_raw: 118614,
    field_660: 'W-118614',
    field_660_raw: 'W-118614',
    field_303: 'Mohamed Ghofrane2670',
    field_303_raw: {
      first: 'Mohamed',
      last: 'Ghofrane2670',
      formatted_value: 'Mohamed Ghofrane2670'
    },
    field_304: '',
    field_305: '',
    field_306: 'active',
    field_306_raw: 'active',
    field_307: '<span class="profile_30">Worker</span>',
    field_307_raw: [ 'profile_30' ],
    field_315: '<span class="5fbd6688490f05001bc6d819">TNU Services - Intelcom</span>',
    field_315_raw: [
      {
        id: '5fbd6688490f05001bc6d819',
        identifier: 'TNU Services - Intelcom'
      }
    ],
    field_320: '',
    field_318: '07/27/2022 11:30pm',
    field_318_raw: {
      date: '07/27/2022',
      date_formatted: '07/27/2022',
      hours: '11',
      minutes: '30',
      am_pm: 'PM',
      unix_timestamp: 1658964600000,
      iso_timestamp: '2022-07-27T23:30:00.000Z',
      timestamp: '07/27/2022 11:30 pm',
      time: 1410
    },
    field_720: '',
    field_1208: '',
    field_1220: '',
    field_1221: '',
    field_1222: '',
    field_1223: '',
    field_1224: '',
    field_1225: '',
    field_1226: '',
    field_1227: '',
    field_1228: '',
    field_1229: 'No',
    field_1229_raw: false,
    field_1230: '',
    field_1231: '',
    field_1231_raw: [],
    field_1232: '',
    field_1233: '',
    field_1234: '',
    field_1235: '',
    field_1236: '',
    field_1237: '',
    field_1238: '',
    field_1238_raw: '',
    field_1241: 'No',
    field_1241_raw: false,
    field_1253: 0,
    field_1253_raw: 0,
    field_1342: 'No',
    field_1342_raw: false,
    field_1373: '',
    field_1547: 'No',
    field_1547_raw: false,
    field_1546: '',
    field_1588: 'Yes',
    field_1588_raw: true,
    field_1899: 3,
    field_1899_raw: 3,
    field_1900: 1,
    field_1900_raw: 1,
    field_1987: '',
    field_2093: '',
    field_2143: 'Mohamed Ghofrane2670',
    field_2143_raw: 'Mohamed Ghofrane2670',
    field_2248: '2670',
    field_2248_raw: '2670',
    field_2250: 'Mohamed Ghofrane2670 - 2670',
    field_2250_raw: 'Mohamed Ghofrane2670 - 2670'
  },
  level: 'info',
  timestamp: '2022-09-13T21:45:48.599Z'
}
{
  message: 'postUrl https://api.knack.com/v1/objects/object_30/records/62f479f10cb4a400214e93d8 payload [object Object]',
  level: 'info',
  timestamp: '2022-09-13T21:45:48.599Z'
}
{
  message: { field_2248: '2670' },
  level: 'info',
  timestamp: '2022-09-13T21:45:48.599Z'
}
{
  message: {
    id: '62f479f10cb4a400214e93d8',
    account_status: 'active',
    approval_status: 'approved',
    profile_keys: 'Worker',
    profile_keys_raw: [ { id: 'profile_30', identifier: 'Worker' } ],
    field_658: 120153,
    field_658_raw: 120153,
    field_659: 120353,
    field_659_raw: 120353,
    field_660: 'W-120353',
    field_660_raw: 'W-120353',
    field_303: 'Mohamed Ghofrane2670',
    field_303_raw: {
      first: 'Mohamed',
      last: 'Ghofrane2670',
      formatted_value: 'Mohamed Ghofrane2670'
    },
    field_304: '',
    field_305: '',
    field_306: 'active',
    field_306_raw: 'active',
    field_307: '<span class="profile_30">Worker</span>',
    field_307_raw: [ 'profile_30' ],
    field_315: '<span class="5fbd6688490f05001bc6d819">TNU Services - Intelcom</span>',
    field_315_raw: [
      {
        id: '5fbd6688490f05001bc6d819',
        identifier: 'TNU Services - Intelcom'
      }
    ],
    field_320: '',
    field_318: '08/10/2022 11:39pm',
    field_318_raw: {
      date: '08/10/2022',
      date_formatted: '08/10/2022',
      hours: '11',
      minutes: '39',
      am_pm: 'PM',
      unix_timestamp: 1660174740000,
      iso_timestamp: '2022-08-10T23:39:00.000Z',
      timestamp: '08/10/2022 11:39 pm',
      time: 1419
    },
    field_720: '',
    field_1208: '',
    field_1220: '',
    field_1221: '',
    field_1222: '',
    field_1223: '',
    field_1224: '',
    field_1225: '',
    field_1226: '',
    field_1227: '',
    field_1228: '',
    field_1229: 'No',
    field_1229_raw: false,
    field_1230: '',
    field_1231: '',
    field_1231_raw: [],
    field_1232: '',
    field_1233: '',
    field_1234: '',
    field_1235: '',
    field_1236: '',
    field_1237: '',
    field_1238: '',
    field_1238_raw: '',
    field_1241: 'No',
    field_1241_raw: false,
    field_1253: 0,
    field_1253_raw: 0,
    field_1342: 'No',
    field_1342_raw: false,
    field_1373: '',
    field_1547: 'No',
    field_1547_raw: false,
    field_1546: '',
    field_1588: 'Yes',
    field_1588_raw: true,
    field_1899: 2,
    field_1899_raw: 2,
    field_1900: 1,
    field_1900_raw: 1,
    field_1987: '',
    field_2093: '',
    field_2143: 'Mohamed Ghofrane2670',
    field_2143_raw: 'Mohamed Ghofrane2670',
    field_2248: '2670',
    field_2248_raw: '2670',
    field_2250: 'Mohamed Ghofrane2670 - 2670',
    field_2250_raw: 'Mohamed Ghofrane2670 - 2670'
  },
  level: 'info',
  timestamp: '2022-09-13T21:45:49.543Z'
}
{
  message: 'postUrl https://api.knack.com/v1/objects/object_30/records/62e9ac61eb3ead0021482d9d payload [object Object]',
  level: 'info',
  timestamp: '2022-09-13T21:45:49.544Z'
}
{
  message: { field_2248: '9939' },
  level: 'info',
  timestamp: '2022-09-13T21:45:49.544Z'
}
{
  message: {
    id: '62e9ac61eb3ead0021482d9d',
    account_status: 'active',
    approval_status: 'approved',
    profile_keys: 'Worker',
    profile_keys_raw: [ { id: 'profile_30', identifier: 'Worker' } ],
    field_658: 118975,
    field_658_raw: 118975,
    field_659: 119175,
    field_659_raw: 119175,
    field_660: 'W-119175',
    field_660_raw: 'W-119175',
    field_303: 'Nassima Guebsi9939',
    field_303_raw: {
      first: 'Nassima',
      last: 'Guebsi9939',
      formatted_value: 'Nassima Guebsi9939'
    },
    field_304: '',
    field_305: '*********',
    field_305_raw: '**********',
    field_306: 'active',
    field_306_raw: 'active',
    field_307: '<span class="profile_30">Worker</span>',
    field_307_raw: [ 'profile_30' ],
    field_315: '<span class="5fbd6688490f05001bc6d819">TNU Services - Intelcom</span>',
    field_315_raw: [
      {
        id: '5fbd6688490f05001bc6d819',
        identifier: 'TNU Services - Intelcom'
      }
    ],
    field_320: '<span class="5fbd673eb20d90001bb93d9b">Alexandre Khalifa Khalifa</span>',
    field_320_raw: [
      {
        id: '5fbd673eb20d90001bb93d9b',
        identifier: 'Alexandre Khalifa Khalifa'
      }
    ],
    field_318: '08/02/2022 6:59pm',
    field_318_raw: {
      date: '08/02/2022',
      date_formatted: '08/02/2022',
      hours: '06',
      minutes: '59',
      am_pm: 'PM',
      unix_timestamp: 1659466740000,
      iso_timestamp: '2022-08-02T18:59:00.000Z',
      timestamp: '08/02/2022 06:59 pm',
      time: 1139
    },
    field_720: '',
    field_1208: '',
    field_1220: '',
    field_1221: '',
    field_1222: '',
    field_1223: '',
    field_1224: '',
    field_1225: '',
    field_1226: '',
    field_1227: '',
    field_1228: '',
    field_1229: 'No',
    field_1229_raw: false,
    field_1230: '',
    field_1231: '',
    field_1231_raw: [],
    field_1232: '',
    field_1233: '',
    field_1234: '',
    field_1235: '',
    field_1236: '<span class="5bfecfdd31782f6061574545">Intelcom Courier Canada</span>',
    field_1236_raw: [
      {
        id: '5bfecfdd31782f6061574545',
        identifier: 'Intelcom Courier Canada'
      }
    ],
    field_1237: '',
    field_1238: '',
    field_1238_raw: '',
    field_1241: 'No',
    field_1241_raw: false,
    field_1253: 0,
    field_1253_raw: 0,
    field_1342: 'No',
    field_1342_raw: false,
    field_1373: '',
    field_1547: 'No',
    field_1547_raw: false,
    field_1546: '',
    field_1588: 'No',
    field_1588_raw: false,
    field_1899: 27,
    field_1899_raw: 27,
    field_1900: 0,
    field_1900_raw: 0,
    field_1987: '',
    field_1987_raw: [],
    field_2093: '',
    field_2143: 'Nassima Guebsi9939',
    field_2143_raw: 'Nassima Guebsi9939',
    field_2248: '9939',
    field_2248_raw: '9939',
    field_2250: 'Nassima Guebsi9939 - 9939',
    field_2250_raw: 'Nassima Guebsi9939 - 9939'
  },
  level: 'info',
  timestamp: '2022-09-13T21:45:50.747Z'
}
{
  message: 'postUrl https://api.knack.com/v1/objects/object_30/records/62e2ceb63285e9002105c83a payload [object Object]',
  level: 'info',
  timestamp: '2022-09-13T21:45:50.747Z'
}
{
  message: { field_2248: '8997' },
  level: 'info',
  timestamp: '2022-09-13T21:45:50.747Z'
}
{
  message: {
    id: '62e2ceb63285e9002105c83a',
    account_status: 'active',
    approval_status: 'approved',
    profile_keys: 'Worker',
    profile_keys_raw: [ { id: 'profile_30', identifier: 'Worker' } ],
    field_658: 118896,
    field_658_raw: 118896,
    field_659: 119096,
    field_659_raw: 119096,
    field_660: 'W-119096',
    field_660_raw: 'W-119096',
    field_303: 'Wael Hammi8997',
    field_303_raw: {
      first: 'Wael',
      last: 'Hammi8997',
      formatted_value: 'Wael Hammi8997'
    },
    field_304: '',
    field_305: '*********',
    field_305_raw: '**********',
    field_306: 'active',
    field_306_raw: 'active',
    field_307: '<span class="profile_30">Worker</span>',
    field_307_raw: [ 'profile_30' ],
    field_315: '<span class="5fbd6688490f05001bc6d819">TNU Services - Intelcom</span>',
    field_315_raw: [
      {
        id: '5fbd6688490f05001bc6d819',
        identifier: 'TNU Services - Intelcom'
      }
    ],
    field_320: '<span class="5fbd673eb20d90001bb93d9b">Alexandre Khalifa Khalifa</span>',
    field_320_raw: [
      {
        id: '5fbd673eb20d90001bb93d9b',
        identifier: 'Alexandre Khalifa Khalifa'
      }
    ],
    field_318: '07/28/2022 2:00pm',
    field_318_raw: {
      date: '07/28/2022',
      date_formatted: '07/28/2022',
      hours: '02',
      minutes: '00',
      am_pm: 'PM',
      unix_timestamp: 1659016800000,
      iso_timestamp: '2022-07-28T14:00:00.000Z',
      timestamp: '07/28/2022 02:00 pm',
      time: 840
    },
    field_720: '',
    field_1208: '',
    field_1220: '',
    field_1221: '',
    field_1222: '',
    field_1223: '',
    field_1224: '',
    field_1225: '',
    field_1226: '',
    field_1227: '',
    field_1228: '',
    field_1229: 'No',
    field_1229_raw: false,
    field_1230: '',
    field_1231: '',
    field_1231_raw: [],
    field_1232: '',
    field_1233: '',
    field_1234: '',
    field_1235: '',
    field_1236: '<span class="5bfecfdd31782f6061574545">Intelcom Courier Canada</span>',
    field_1236_raw: [
      {
        id: '5bfecfdd31782f6061574545',
        identifier: 'Intelcom Courier Canada'
      }
    ],
    field_1237: '',
    field_1238: '',
    field_1238_raw: '',
    field_1241: 'No',
    field_1241_raw: false,
    field_1253: 0,
    field_1253_raw: 0,
    field_1342: 'No',
    field_1342_raw: false,
    field_1373: '',
    field_1547: 'No',
    field_1547_raw: false,
    field_1546: '',
    field_1588: 'No',
    field_1588_raw: false,
    field_1899: 11,
    field_1899_raw: 11,
    field_1900: 0,
    field_1900_raw: 0,
    field_1987: '',
    field_1987_raw: [],
    field_2093: '',
    field_2143: 'Wael Hammi8997',
    field_2143_raw: 'Wael Hammi8997',
    field_2248: '8997',
    field_2248_raw: '8997',
    field_2250: 'Wael Hammi8997 - 8997',
    field_2250_raw: 'Wael Hammi8997 - 8997'
  },
  level: 'info',
  timestamp: '2022-09-13T21:45:52.083Z'
}
{
  message: 'postUrl https://api.knack.com/v1/objects/object_30/records/62d99706e871290021d2fba4 payload [object Object]',
  level: 'info',
  timestamp: '2022-09-13T21:45:52.083Z'
}
{
  message: { field_2248: '9084' },
  level: 'info',
  timestamp: '2022-09-13T21:45:52.083Z'
}
{
  message: {
    id: '62d99706e871290021d2fba4',
    account_status: 'active',
    approval_status: 'approved',
    profile_keys: 'Worker',
    profile_keys_raw: [ { id: 'profile_30', identifier: 'Worker' } ],
    field_658: 117827,
    field_658_raw: 117827,
    field_659: 118027,
    field_659_raw: 118027,
    field_660: 'W-118027',
    field_660_raw: 'W-118027',
    field_303: 'flavian hermi9084',
    field_303_raw: {
      first: 'flavian',
      last: 'hermi9084',
      formatted_value: 'flavian hermi9084'
    },
    field_304: '',
    field_305: '*********',
    field_305_raw: '**********',
    field_306: 'active',
    field_306_raw: 'active',
    field_307: '<span class="profile_30">Worker</span>',
    field_307_raw: [ 'profile_30' ],
    field_315: '<span class="5fbd6688490f05001bc6d819">TNU Services - Intelcom</span>',
    field_315_raw: [
      {
        id: '5fbd6688490f05001bc6d819',
        identifier: 'TNU Services - Intelcom'
      }
    ],
    field_320: '<span class="5fbd673eb20d90001bb93d9b">Alexandre Khalifa Khalifa</span>',
    field_320_raw: [
      {
        id: '5fbd673eb20d90001bb93d9b',
        identifier: 'Alexandre Khalifa Khalifa'
      }
    ],
    field_318: '07/21/2022 2:12pm',
    field_318_raw: {
      date: '07/21/2022',
      date_formatted: '07/21/2022',
      hours: '02',
      minutes: '12',
      am_pm: 'PM',
      unix_timestamp: 1658412720000,
      iso_timestamp: '2022-07-21T14:12:00.000Z',
      timestamp: '07/21/2022 02:12 pm',
      time: 852
    },
    field_720: '',
    field_1208: '',
    field_1220: '',
    field_1221: '',
    field_1222: '',
    field_1223: '',
    field_1224: '',
    field_1225: '',
    field_1226: '',
    field_1227: '',
    field_1228: '',
    field_1229: 'No',
    field_1229_raw: false,
    field_1230: '',
    field_1231: '',
    field_1231_raw: [],
    field_1232: '',
    field_1233: '',
    field_1234: '',
    field_1235: '',
    field_1236: '<span class="5bfecfdd31782f6061574545">Intelcom Courier Canada</span>',
    field_1236_raw: [
      {
        id: '5bfecfdd31782f6061574545',
        identifier: 'Intelcom Courier Canada'
      }
    ],
    field_1237: '',
    field_1238: '',
    field_1238_raw: '',
    field_1241: 'No',
    field_1241_raw: false,
    field_1253: 0,
    field_1253_raw: 0,
    field_1342: 'No',
    field_1342_raw: false,
    field_1373: '',
    field_1547: 'No',
    field_1547_raw: false,
    field_1546: '',
    field_1588: 'No',
    field_1588_raw: false,
    field_1899: 7,
    field_1899_raw: 7,
    field_1900: 0,
    field_1900_raw: 0,
    field_1987: '',
    field_1987_raw: [],
    field_2093: '',
    field_2143: 'flavian hermi9084',
    field_2143_raw: 'flavian hermi9084',
    field_2248: '9084',
    field_2248_raw: '9084',
    field_2250: 'flavian hermi9084 - 9084',
    field_2250_raw: 'flavian hermi9084 - 9084'
  },
  level: 'info',
  timestamp: '2022-09-13T21:45:52.783Z'
}
{
  message: 'count of recors page 1 with number in name: 50',
  level: 'info',
  timestamp: '2022-09-13T21:45:52.783Z'
}
{
  message: 'postUrl https://api.knack.com/v1/objects/object_30/records/62eb2f1fc622a7002134ac8a payload [object Object]',
  level: 'info',
  timestamp: '2022-09-13T21:45:59.715Z'
}
{
  message: { field_2248: '5689' },
  level: 'info',
  timestamp: '2022-09-13T21:45:59.716Z'
}
{
  message: {
    id: '62eb2f1fc622a7002134ac8a',
    account_status: 'active',
    approval_status: 'approved',
    profile_keys: 'Worker',
    profile_keys_raw: [ { id: 'profile_30', identifier: 'Worker' } ],
    field_658: 119339,
    field_658_raw: 119339,
    field_659: 119539,
    field_659_raw: 119539,
    field_660: 'W-119539',
    field_660_raw: 'W-119539',
    field_303: 'Mathis Kaka5689',
    field_303_raw: {
      first: 'Mathis',
      last: 'Kaka5689',
      formatted_value: 'Mathis Kaka5689'
    },
    field_304: '',
    field_305: '',
    field_306: 'active',
    field_306_raw: 'active',
    field_307: '<span class="profile_30">Worker</span>',
    field_307_raw: [ 'profile_30' ],
    field_315: '<span class="5fbd6688490f05001bc6d819">TNU Services - Intelcom</span>',
    field_315_raw: [
      {
        id: '5fbd6688490f05001bc6d819',
        identifier: 'TNU Services - Intelcom'
      }
    ],
    field_320: '',
    field_318: '08/03/2022 10:29pm',
    field_318_raw: {
      date: '08/03/2022',
      date_formatted: '08/03/2022',
      hours: '10',
      minutes: '29',
      am_pm: 'PM',
      unix_timestamp: 1659565740000,
      iso_timestamp: '2022-08-03T22:29:00.000Z',
      timestamp: '08/03/2022 10:29 pm',
      time: 1349
    },
    field_720: '',
    field_1208: '',
    field_1220: '',
    field_1221: '',
    field_1222: '',
    field_1223: '',
    field_1224: '',
    field_1225: '',
    field_1226: '',
    field_1227: '',
    field_1228: '',
    field_1229: 'No',
    field_1229_raw: false,
    field_1230: '',
    field_1231: '',
    field_1231_raw: [],
    field_1232: '',
    field_1233: '',
    field_1234: '',
    field_1235: '',
    field_1236: '',
    field_1237: '',
    field_1238: '',
    field_1238_raw: '',
    field_1241: 'No',
    field_1241_raw: false,
    field_1253: 0,
    field_1253_raw: 0,
    field_1342: 'No',
    field_1342_raw: false,
    field_1373: '',
    field_1547: 'No',
    field_1547_raw: false,
    field_1546: '',
    field_1588: 'Yes',
    field_1588_raw: true,
    field_1899: 5,
    field_1899_raw: 5,
    field_1900: 1,
    field_1900_raw: 1,
    field_1987: '',
    field_2093: '',
    field_2143: 'Mathis Kaka5689',
    field_2143_raw: 'Mathis Kaka5689',
    field_2248: '5689',
    field_2248_raw: '5689',
    field_2250: 'Mathis Kaka5689 - 5689',
    field_2250_raw: 'Mathis Kaka5689 - 5689'
  },
  level: 'info',
  timestamp: '2022-09-13T21:46:00.617Z'
}
{
  message: 'postUrl https://api.knack.com/v1/objects/object_30/records/62e2d39f6ae43c00218c0e6a payload [object Object]',
  level: 'info',
  timestamp: '2022-09-13T21:46:00.617Z'
}
{
  message: { field_2248: '5689' },
  level: 'info',
  timestamp: '2022-09-13T21:46:00.617Z'
}
{
  message: {
    id: '62e2d39f6ae43c00218c0e6a',
    account_status: 'active',
    approval_status: 'approved',
    profile_keys: 'Worker',
    profile_keys_raw: [ { id: 'profile_30', identifier: 'Worker' } ],
    field_658: 118898,
    field_658_raw: 118898,
    field_659: 119098,
    field_659_raw: 119098,
    field_660: 'W-119098',
    field_660_raw: 'W-119098',
    field_303: 'Mathis  Kaka5689',
    field_303_raw: {
      first: 'Mathis ',
      last: 'Kaka5689',
      formatted_value: 'Mathis  Kaka5689'
    },
    field_304: '',
    field_305: '*********',
    field_305_raw: '**********',
    field_306: 'active',
    field_306_raw: 'active',
    field_307: '<span class="profile_30">Worker</span>',
    field_307_raw: [ 'profile_30' ],
    field_315: '<span class="5fbd6688490f05001bc6d819">TNU Services - Intelcom</span>',
    field_315_raw: [
      {
        id: '5fbd6688490f05001bc6d819',
        identifier: 'TNU Services - Intelcom'
      }
    ],
    field_320: '<span class="5fbd673eb20d90001bb93d9b">Alexandre Khalifa Khalifa</span>',
    field_320_raw: [
      {
        id: '5fbd673eb20d90001bb93d9b',
        identifier: 'Alexandre Khalifa Khalifa'
      }
    ],
    field_318: '07/28/2022 2:21pm',
    field_318_raw: {
      date: '07/28/2022',
      date_formatted: '07/28/2022',
      hours: '02',
      minutes: '21',
      am_pm: 'PM',
      unix_timestamp: 1659018060000,
      iso_timestamp: '2022-07-28T14:21:00.000Z',
      timestamp: '07/28/2022 02:21 pm',
      time: 861
    },
    field_720: '',
    field_1208: '',
    field_1220: '',
    field_1221: '',
    field_1222: '',
    field_1223: '',
    field_1224: '',
    field_1225: '',
    field_1226: '',
    field_1227: '',
    field_1228: '',
    field_1229: 'No',
    field_1229_raw: false,
    field_1230: '',
    field_1231: '',
    field_1231_raw: [],
    field_1232: '',
    field_1233: '',
    field_1234: '',
    field_1235: '',
    field_1236: '<span class="5bfecfdd31782f6061574545">Intelcom Courier Canada</span>',
    field_1236_raw: [
      {
        id: '5bfecfdd31782f6061574545',
        identifier: 'Intelcom Courier Canada'
      }
    ],
    field_1237: '',
    field_1238: '',
    field_1238_raw: '',
    field_1241: 'No',
    field_1241_raw: false,
    field_1253: 0,
    field_1253_raw: 0,
    field_1342: 'No',
    field_1342_raw: false,
    field_1373: '',
    field_1547: 'No',
    field_1547_raw: false,
    field_1546: '',
    field_1588: 'No',
    field_1588_raw: false,
    field_1899: 10,
    field_1899_raw: 10,
    field_1900: 0,
    field_1900_raw: 0,
    field_1987: '',
    field_1987_raw: [],
    field_2093: '',
    field_2143: 'Mathis  Kaka5689',
    field_2143_raw: 'Mathis  Kaka5689',
    field_2248: '5689',
    field_2248_raw: '5689',
    field_2250: 'Mathis  Kaka5689 - 5689',
    field_2250_raw: 'Mathis  Kaka5689 - 5689'
  },
  level: 'info',
  timestamp: '2022-09-13T21:46:01.287Z'
}
{
  message: 'postUrl https://api.knack.com/v1/objects/object_30/records/62d984b70e74e5002100f829 payload [object Object]',
  level: 'info',
  timestamp: '2022-09-13T21:46:01.287Z'
}
{
  message: { field_2248: '5689' },
  level: 'info',
  timestamp: '2022-09-13T21:46:01.287Z'
}
{
  message: {
    id: '62d984b70e74e5002100f829',
    account_status: 'active',
    approval_status: 'approved',
    profile_keys: 'Worker',
    profile_keys_raw: [ { id: 'profile_30', identifier: 'Worker' } ],
    field_658: 117793,
    field_658_raw: 117793,
    field_659: 117993,
    field_659_raw: 117993,
    field_660: 'W-117993',
    field_660_raw: 'W-117993',
    field_303: 'mathis  kaka5689',
    field_303_raw: {
      first: 'mathis ',
      last: 'kaka5689',
      formatted_value: 'mathis  kaka5689'
    },
    field_304: '',
    field_305: '*********',
    field_305_raw: '**********',
    field_306: 'active',
    field_306_raw: 'active',
    field_307: '<span class="profile_30">Worker</span>',
    field_307_raw: [ 'profile_30' ],
    field_315: '<span class="5fbd6688490f05001bc6d819">TNU Services - Intelcom</span>',
    field_315_raw: [
      {
        id: '5fbd6688490f05001bc6d819',
        identifier: 'TNU Services - Intelcom'
      }
    ],
    field_320: '<span class="5fbd673eb20d90001bb93d9b">Alexandre Khalifa Khalifa</span>',
    field_320_raw: [
      {
        id: '5fbd673eb20d90001bb93d9b',
        identifier: 'Alexandre Khalifa Khalifa'
      }
    ],
    field_318: '07/21/2022 12:54pm',
    field_318_raw: {
      date: '07/21/2022',
      date_formatted: '07/21/2022',
      hours: '12',
      minutes: '54',
      am_pm: 'PM',
      unix_timestamp: 1658408040000,
      iso_timestamp: '2022-07-21T12:54:00.000Z',
      timestamp: '07/21/2022 12:54 pm',
      time: 774
    },
    field_720: '',
    field_1208: '',
    field_1220: '',
    field_1221: '',
    field_1222: '',
    field_1223: '',
    field_1224: '',
    field_1225: '',
    field_1226: '',
    field_1227: '',
    field_1228: '',
    field_1229: 'No',
    field_1229_raw: false,
    field_1230: '',
    field_1231: '',
    field_1231_raw: [],
    field_1232: '',
    field_1233: '',
    field_1234: '',
    field_1235: '',
    field_1236: '<span class="5bfecfdd31782f6061574545">Intelcom Courier Canada</span>',
    field_1236_raw: [
      {
        id: '5bfecfdd31782f6061574545',
        identifier: 'Intelcom Courier Canada'
      }
    ],
    field_1237: '',
    field_1238: '',
    field_1238_raw: '',
    field_1241: 'No',
    field_1241_raw: false,
    field_1253: 0,
    field_1253_raw: 0,
    field_1342: 'No',
    field_1342_raw: false,
    field_1373: '',
    field_1547: 'No',
    field_1547_raw: false,
    field_1546: '',
    field_1588: 'No',
    field_1588_raw: false,
    field_1899: 13,
    field_1899_raw: 13,
    field_1900: 0,
    field_1900_raw: 0,
    field_1987: '',
    field_1987_raw: [],
    field_2093: '',
    field_2143: 'mathis  kaka5689',
    field_2143_raw: 'mathis  kaka5689',
    field_2248: '5689',
    field_2248_raw: '5689',
    field_2250: 'mathis  kaka5689 - 5689',
    field_2250_raw: 'mathis  kaka5689 - 5689'
  },
  level: 'info',
  timestamp: '2022-09-13T21:46:02.590Z'
}
{
  message: 'postUrl https://api.knack.com/v1/objects/object_30/records/62fda52698efb00021843a6f payload [object Object]',
  level: 'info',
  timestamp: '2022-09-13T21:46:02.590Z'
}
{
  message: { field_2248: '5689' },
  level: 'info',
  timestamp: '2022-09-13T21:46:02.590Z'
}
{
  message: {
    id: '62fda52698efb00021843a6f',
    account_status: 'active',
    approval_status: 'approved',
    profile_keys: 'Worker',
    profile_keys_raw: [ { id: 'profile_30', identifier: 'Worker' } ],
    field_658: 120880,
    field_658_raw: 120880,
    field_659: 121080,
    field_659_raw: 121080,
    field_660: 'W-121080',
    field_660_raw: 'W-121080',
    field_303: 'Mathis Kaka5689',
    field_303_raw: {
      first: 'Mathis',
      last: 'Kaka5689',
      formatted_value: 'Mathis Kaka5689'
    },
    field_304: '',
    field_305: '',
    field_306: 'active',
    field_306_raw: 'active',
    field_307: '<span class="profile_30">Worker</span>',
    field_307_raw: [ 'profile_30' ],
    field_315: '<span class="5fbd6688490f05001bc6d819">TNU Services - Intelcom</span>',
    field_315_raw: [
      {
        id: '5fbd6688490f05001bc6d819',
        identifier: 'TNU Services - Intelcom'
      }
    ],
    field_320: '',
    field_318: '08/17/2022 10:34pm',
    field_318_raw: {
      date: '08/17/2022',
      date_formatted: '08/17/2022',
      hours: '10',
      minutes: '34',
      am_pm: 'PM',
      unix_timestamp: 1660775640000,
      iso_timestamp: '2022-08-17T22:34:00.000Z',
      timestamp: '08/17/2022 10:34 pm',
      time: 1354
    },
    field_720: '',
    field_1208: '',
    field_1220: '',
    field_1221: '',
    field_1222: '',
    field_1223: '',
    field_1224: '',
    field_1225: '',
    field_1226: '',
    field_1227: '',
    field_1228: '',
    field_1229: 'No',
    field_1229_raw: false,
    field_1230: '',
    field_1231: '',
    field_1231_raw: [],
    field_1232: '',
    field_1233: '',
    field_1234: '',
    field_1235: '',
    field_1236: '',
    field_1237: '',
    field_1238: '',
    field_1238_raw: '',
    field_1241: 'No',
    field_1241_raw: false,
    field_1253: 0,
    field_1253_raw: 0,
    field_1342: 'No',
    field_1342_raw: false,
    field_1373: '',
    field_1547: 'No',
    field_1547_raw: false,
    field_1546: '',
    field_1588: 'Yes',
    field_1588_raw: true,
    field_1899: 1,
    field_1899_raw: 1,
    field_1900: 1,
    field_1900_raw: 1,
    field_1987: '',
    field_2093: '',
    field_2143: 'Mathis Kaka5689',
    field_2143_raw: 'Mathis Kaka5689',
    field_2248: '5689',
    field_2248_raw: '5689',
    field_2250: 'Mathis Kaka5689 - 5689',
    field_2250_raw: 'Mathis Kaka5689 - 5689'
  },
  level: 'info',
  timestamp: '2022-09-13T21:46:04.574Z'
}
{
  message: 'postUrl https://api.knack.com/v1/objects/object_30/records/6306f158163792002135c7ec payload [object Object]',
  level: 'info',
  timestamp: '2022-09-13T21:46:04.574Z'
}
{
  message: { field_2248: '5689' },
  level: 'info',
  timestamp: '2022-09-13T21:46:04.574Z'
}
{
  message: {
    id: '6306f158163792002135c7ec',
    account_status: 'active',
    approval_status: 'approved',
    profile_keys: 'Worker',
    profile_keys_raw: [ { id: 'profile_30', identifier: 'Worker' } ],
    field_658: 121600,
    field_658_raw: 121600,
    field_659: 121800,
    field_659_raw: 121800,
    field_660: 'W-121800',
    field_660_raw: 'W-121800',
    field_303: 'Mathis Kaka5689',
    field_303_raw: {
      first: 'Mathis',
      last: 'Kaka5689',
      formatted_value: 'Mathis Kaka5689'
    },
    field_304: '',
    field_305: '',
    field_306: 'active',
    field_306_raw: 'active',
    field_307: '<span class="profile_30">Worker</span>',
    field_307_raw: [ 'profile_30' ],
    field_315: '<span class="5fbd6688490f05001bc6d819">TNU Services - Intelcom</span>',
    field_315_raw: [
      {
        id: '5fbd6688490f05001bc6d819',
        identifier: 'TNU Services - Intelcom'
      }
    ],
    field_320: '',
    field_318: '08/24/2022 11:49pm',
    field_318_raw: {
      date: '08/24/2022',
      date_formatted: '08/24/2022',
      hours: '11',
      minutes: '49',
      am_pm: 'PM',
      unix_timestamp: 1661384940000,
      iso_timestamp: '2022-08-24T23:49:00.000Z',
      timestamp: '08/24/2022 11:49 pm',
      time: 1429
    },
    field_720: '',
    field_1208: '',
    field_1220: '',
    field_1221: '',
    field_1222: '',
    field_1223: '',
    field_1224: '',
    field_1225: '',
    field_1226: '',
    field_1227: '',
    field_1228: '',
    field_1229: 'No',
    field_1229_raw: false,
    field_1230: '',
    field_1231: '',
    field_1231_raw: [],
    field_1232: '',
    field_1233: '',
    field_1234: '',
    field_1235: '',
    field_1236: '',
    field_1237: '',
    field_1238: '',
    field_1238_raw: '',
    field_1241: 'No',
    field_1241_raw: false,
    field_1253: 0,
    field_1253_raw: 0,
    field_1342: 'No',
    field_1342_raw: false,
    field_1373: '',
    field_1547: 'No',
    field_1547_raw: false,
    field_1546: '',
    field_1588: 'Yes',
    field_1588_raw: true,
    field_1899: 1,
    field_1899_raw: 1,
    field_1900: 1,
    field_1900_raw: 1,
    field_1987: '',
    field_2093: '',
    field_2143: 'Mathis Kaka5689',
    field_2143_raw: 'Mathis Kaka5689',
    field_2248: '5689',
    field_2248_raw: '5689',
    field_2250: 'Mathis Kaka5689 - 5689',
    field_2250_raw: 'Mathis Kaka5689 - 5689'
  },
  level: 'info',
  timestamp: '2022-09-13T21:46:05.525Z'
}
{
  message: 'postUrl https://api.knack.com/v1/objects/object_30/records/6310bec5d067f50023b8b616 payload [object Object]',
  level: 'info',
  timestamp: '2022-09-13T21:46:05.526Z'
}
{
  message: { field_2248: '5689' },
  level: 'info',
  timestamp: '2022-09-13T21:46:05.526Z'
}
{
  message: {
    id: '6310bec5d067f50023b8b616',
    account_status: 'active',
    approval_status: 'approved',
    profile_keys: 'Worker',
    profile_keys_raw: [ { id: 'profile_30', identifier: 'Worker' } ],
    field_658: 122280,
    field_658_raw: 122280,
    field_659: 122480,
    field_659_raw: 122480,
    field_660: 'W-122480',
    field_660_raw: 'W-122480',
    field_303: 'Mathis Kaka5689',
    field_303_raw: {
      first: 'Mathis',
      last: 'Kaka5689',
      formatted_value: 'Mathis Kaka5689'
    },
    field_304: '',
    field_305: '',
    field_306: 'active',
    field_306_raw: 'active',
    field_307: '<span class="profile_30">Worker</span>',
    field_307_raw: [ 'profile_30' ],
    field_315: '<span class="5fbd6688490f05001bc6d819">TNU Services - Intelcom</span>',
    field_315_raw: [
      {
        id: '5fbd6688490f05001bc6d819',
        identifier: 'TNU Services - Intelcom'
      }
    ],
    field_320: '',
    field_318: '09/01/2022 10:16am',
    field_318_raw: {
      date: '09/01/2022',
      date_formatted: '09/01/2022',
      hours: '10',
      minutes: '16',
      am_pm: 'AM',
      unix_timestamp: 1662027360000,
      iso_timestamp: '2022-09-01T10:16:00.000Z',
      timestamp: '09/01/2022 10:16 am',
      time: 616
    },
    field_720: '',
    field_1208: '',
    field_1220: '',
    field_1221: '',
    field_1222: '',
    field_1223: '',
    field_1224: '',
    field_1225: '',
    field_1226: '',
    field_1227: '',
    field_1228: '',
    field_1229: 'No',
    field_1229_raw: false,
    field_1230: '',
    field_1231: '',
    field_1231_raw: [],
    field_1232: '',
    field_1233: '',
    field_1234: '',
    field_1235: '',
    field_1236: '',
    field_1237: '',
    field_1238: '',
    field_1238_raw: '',
    field_1241: 'No',
    field_1241_raw: false,
    field_1253: 0,
    field_1253_raw: 0,
    field_1342: 'No',
    field_1342_raw: false,
    field_1373: '',
    field_1547: 'No',
    field_1547_raw: false,
    field_1546: '',
    field_1588: 'Yes',
    field_1588_raw: true,
    field_1899: 0,
    field_1899_raw: 0,
    field_1900: 1,
    field_1900_raw: 1,
    field_1987: '',
    field_2093: '',
    field_2143: 'Mathis Kaka5689',
    field_2143_raw: 'Mathis Kaka5689',
    field_2248: '5689',
    field_2248_raw: '5689',
    field_2250: 'Mathis Kaka5689 - 5689',
    field_2250_raw: 'Mathis Kaka5689 - 5689'
  },
  level: 'info',
  timestamp: '2022-09-13T21:46:07.128Z'
}
{
  message: 'postUrl https://api.knack.com/v1/objects/object_30/records/62d9969be871290021d2fb1f payload [object Object]',
  level: 'info',
  timestamp: '2022-09-13T21:46:07.128Z'
}
{
  message: { field_2248: '2890' },
  level: 'info',
  timestamp: '2022-09-13T21:46:07.128Z'
}
{
  message: {
    id: '62d9969be871290021d2fb1f',
    account_status: 'active',
    approval_status: 'approved',
    profile_keys: 'Worker',
    profile_keys_raw: [ { id: 'profile_30', identifier: 'Worker' } ],
    field_658: 117826,
    field_658_raw: 117826,
    field_659: 118026,
    field_659_raw: 118026,
    field_660: 'W-118026',
    field_660_raw: 'W-118026',
    field_303: 'sara kim2890',
    field_303_raw: { first: 'sara', last: 'kim2890', formatted_value: 'sara kim2890' },
    field_304: '',
    field_305: '*********',
    field_305_raw: '**********',
    field_306: 'active',
    field_306_raw: 'active',
    field_307: '<span class="profile_30">Worker</span>',
    field_307_raw: [ 'profile_30' ],
    field_315: '<span class="5fbd6688490f05001bc6d819">TNU Services - Intelcom</span>',
    field_315_raw: [
      {
        id: '5fbd6688490f05001bc6d819',
        identifier: 'TNU Services - Intelcom'
      }
    ],
    field_320: '<span class="5fbd673eb20d90001bb93d9b">Alexandre Khalifa Khalifa</span>',
    field_320_raw: [
      {
        id: '5fbd673eb20d90001bb93d9b',
        identifier: 'Alexandre Khalifa Khalifa'
      }
    ],
    field_318: '07/21/2022 2:10pm',
    field_318_raw: {
      date: '07/21/2022',
      date_formatted: '07/21/2022',
      hours: '02',
      minutes: '10',
      am_pm: 'PM',
      unix_timestamp: 1658412600000,
      iso_timestamp: '2022-07-21T14:10:00.000Z',
      timestamp: '07/21/2022 02:10 pm',
      time: 850
    },
    field_720: '',
    field_1208: '',
    field_1220: '',
    field_1221: '',
    field_1222: '',
    field_1223: '',
    field_1224: '',
    field_1225: '',
    field_1226: '',
    field_1227: '',
    field_1228: '',
    field_1229: 'No',
    field_1229_raw: false,
    field_1230: '',
    field_1231: '',
    field_1231_raw: [],
    field_1232: '',
    field_1233: '',
    field_1234: '',
    field_1235: '',
    field_1236: '<span class="5bfecfdd31782f6061574545">Intelcom Courier Canada</span>',
    field_1236_raw: [
      {
        id: '5bfecfdd31782f6061574545',
        identifier: 'Intelcom Courier Canada'
      }
    ],
    field_1237: '',
    field_1238: '',
    field_1238_raw: '',
    field_1241: 'No',
    field_1241_raw: false,
    field_1253: 0,
    field_1253_raw: 0,
    field_1342: 'No',
    field_1342_raw: false,
    field_1373: '',
    field_1547: 'No',
    field_1547_raw: false,
    field_1546: '',
    field_1588: 'No',
    field_1588_raw: false,
    field_1899: 16,
    field_1899_raw: 16,
    field_1900: 0,
    field_1900_raw: 0,
    field_1987: '',
    field_1987_raw: [],
    field_2093: '',
    field_2143: 'sara kim2890',
    field_2143_raw: 'sara kim2890',
    field_2248: '2890',
    field_2248_raw: '2890',
    field_2250: 'sara kim2890 - 2890',
    field_2250_raw: 'sara kim2890 - 2890'
  },
  level: 'info',
  timestamp: '2022-09-13T21:46:08.016Z'
}
{
  message: 'postUrl https://api.knack.com/v1/objects/object_30/records/62e202ab5a1dd400212e638c payload [object Object]',
  level: 'info',
  timestamp: '2022-09-13T21:46:08.016Z'
}
{
  message: { field_2248: '2890' },
  level: 'info',
  timestamp: '2022-09-13T21:46:08.016Z'
}
{
  message: {
    id: '62e202ab5a1dd400212e638c',
    account_status: 'active',
    approval_status: 'approved',
    profile_keys: 'Worker',
    profile_keys_raw: [ { id: 'profile_30', identifier: 'Worker' } ],
    field_658: 118394,
    field_658_raw: 118394,
    field_659: 118594,
    field_659_raw: 118594,
    field_660: 'W-118594',
    field_660_raw: 'W-118594',
    field_303: 'Sara Kim2890',
    field_303_raw: { first: 'Sara', last: 'Kim2890', formatted_value: 'Sara Kim2890' },
    field_304: '',
    field_305: '',
    field_306: 'active',
    field_306_raw: 'active',
    field_307: '<span class="profile_30">Worker</span>',
    field_307_raw: [ 'profile_30' ],
    field_315: '<span class="5fbd6688490f05001bc6d819">TNU Services - Intelcom</span>',
    field_315_raw: [
      {
        id: '5fbd6688490f05001bc6d819',
        identifier: 'TNU Services - Intelcom'
      }
    ],
    field_320: '',
    field_318: '07/27/2022 11:29pm',
    field_318_raw: {
      date: '07/27/2022',
      date_formatted: '07/27/2022',
      hours: '11',
      minutes: '29',
      am_pm: 'PM',
      unix_timestamp: 1658964540000,
      iso_timestamp: '2022-07-27T23:29:00.000Z',
      timestamp: '07/27/2022 11:29 pm',
      time: 1409
    },
    field_720: '',
    field_1208: '',
    field_1220: '',
    field_1221: '',
    field_1222: '',
    field_1223: '',
    field_1224: '',
    field_1225: '',
    field_1226: '',
    field_1227: '',
    field_1228: '',
    field_1229: 'No',
    field_1229_raw: false,
    field_1230: '',
    field_1231: '',
    field_1231_raw: [],
    field_1232: '',
    field_1233: '',
    field_1234: '',
    field_1235: '',
    field_1236: '',
    field_1237: '',
    field_1238: '',
    field_1238_raw: '',
    field_1241: 'No',
    field_1241_raw: false,
    field_1253: 0,
    field_1253_raw: 0,
    field_1342: 'No',
    field_1342_raw: false,
    field_1373: '',
    field_1547: 'No',
    field_1547_raw: false,
    field_1546: '',
    field_1588: 'Yes',
    field_1588_raw: true,
    field_1899: 10,
    field_1899_raw: 10,
    field_1900: 1,
    field_1900_raw: 1,
    field_1987: '',
    field_2093: '',
    field_2143: 'Sara Kim2890',
    field_2143_raw: 'Sara Kim2890',
    field_2248: '2890',
    field_2248_raw: '2890',
    field_2250: 'Sara Kim2890 - 2890',
    field_2250_raw: 'Sara Kim2890 - 2890'
  },
  level: 'info',
  timestamp: '2022-09-13T21:46:09.271Z'
}
{
  message: 'postUrl https://api.knack.com/v1/objects/object_30/records/62fda4556b51c800223c6d23 payload [object Object]',
  level: 'info',
  timestamp: '2022-09-13T21:46:09.272Z'
}
{
  message: { field_2248: '2890' },
  level: 'info',
  timestamp: '2022-09-13T21:46:09.272Z'
}
{
  message: {
    id: '62fda4556b51c800223c6d23',
    account_status: 'active',
    approval_status: 'approved',
    profile_keys: 'Worker',
    profile_keys_raw: [ { id: 'profile_30', identifier: 'Worker' } ],
    field_658: 120834,
    field_658_raw: 120834,
    field_659: 121034,
    field_659_raw: 121034,
    field_660: 'W-121034',
    field_660_raw: 'W-121034',
    field_303: 'Sara Kim2890',
    field_303_raw: { first: 'Sara', last: 'Kim2890', formatted_value: 'Sara Kim2890' },
    field_304: '',
    field_305: '',
    field_306: 'active',
    field_306_raw: 'active',
    field_307: '<span class="profile_30">Worker</span>',
    field_307_raw: [ 'profile_30' ],
    field_315: '<span class="5fbd6688490f05001bc6d819">TNU Services - Intelcom</span>',
    field_315_raw: [
      {
        id: '5fbd6688490f05001bc6d819',
        identifier: 'TNU Services - Intelcom'
      }
    ],
    field_320: '',
    field_318: '08/17/2022 10:30pm',
    field_318_raw: {
      date: '08/17/2022',
      date_formatted: '08/17/2022',
      hours: '10',
      minutes: '30',
      am_pm: 'PM',
      unix_timestamp: 1660775400000,
      iso_timestamp: '2022-08-17T22:30:00.000Z',
      timestamp: '08/17/2022 10:30 pm',
      time: 1350
    },
    field_720: '',
    field_1208: '',
    field_1220: '',
    field_1221: '',
    field_1222: '',
    field_1223: '',
    field_1224: '',
    field_1225: '',
    field_1226: '',
    field_1227: '',
    field_1228: '',
    field_1229: 'No',
    field_1229_raw: false,
    field_1230: '',
    field_1231: '',
    field_1231_raw: [],
    field_1232: '',
    field_1233: '',
    field_1234: '',
    field_1235: '',
    field_1236: '',
    field_1237: '',
    field_1238: '',
    field_1238_raw: '',
    field_1241: 'No',
    field_1241_raw: false,
    field_1253: 0,
    field_1253_raw: 0,
    field_1342: 'No',
    field_1342_raw: false,
    field_1373: '',
    field_1547: 'No',
    field_1547_raw: false,
    field_1546: '',
    field_1588: 'Yes',
    field_1588_raw: true,
    field_1899: 1,
    field_1899_raw: 1,
    field_1900: 1,
    field_1900_raw: 1,
    field_1987: '',
    field_2093: '',
    field_2143: 'Sara Kim2890',
    field_2143_raw: 'Sara Kim2890',
    field_2248: '2890',
    field_2248_raw: '2890',
    field_2250: 'Sara Kim2890 - 2890',
    field_2250_raw: 'Sara Kim2890 - 2890'
  },
  level: 'info',
  timestamp: '2022-09-13T21:46:14.380Z'
}
{
  message: 'postUrl https://api.knack.com/v1/objects/object_30/records/62d9dc39b6c0450022cb22a3 payload [object Object]',
  level: 'info',
  timestamp: '2022-09-13T21:46:14.381Z'
}
{
  message: { field_2248: '8415' },
  level: 'info',
  timestamp: '2022-09-13T21:46:14.381Z'
}
{
  message: {
    id: '62d9dc39b6c0450022cb22a3',
    account_status: 'active',
    approval_status: 'approved',
    profile_keys: 'Worker',
    profile_keys_raw: [ { id: 'profile_30', identifier: 'Worker' } ],
    field_658: 117855,
    field_658_raw: 117855,
    field_659: 118055,
    field_659_raw: 118055,
    field_660: 'W-118055',
    field_660_raw: 'W-118055',
    field_303: 'Monique Kouemi8415',
    field_303_raw: {
      first: 'Monique',
      last: 'Kouemi8415',
      formatted_value: 'Monique Kouemi8415'
    },
    field_304: '',
    field_305: '*********',
    field_305_raw: '**********',
    field_306: 'active',
    field_306_raw: 'active',
    field_307: '<span class="profile_30">Worker</span>',
    field_307_raw: [ 'profile_30' ],
    field_315: '<span class="5fbd6688490f05001bc6d819">TNU Services - Intelcom</span>',
    field_315_raw: [
      {
